,title,author,text,numcm,ups,downs,score,likes,link,time,id
256,My little baby was vandalized yesterday by a special someone in minutes.,VladJongUn,FML. Nothing taken-just someone who destroyed one window and left. I don't know who could do this to something as adorable as my fiat. Also my daily driver and it's subzero out,21,31,0,31,,https://www.reddit.com/r/abarth/comments/10px4p8/my_little_baby_was_vandalized_yesterday_by_a/,1675166074.0,10px4p8
257,Fordge Actuator and Air Intake - Question,Lxn566,"595 2016 145bhp
Looking to increase bhp by installing a TD04 turbo, airtec Intercooler and remap

Anyone used the fordge actuator and air intake? what do you think? pros and cons? are they good for about 250-300bhp builds?",6,0,0,0,,https://www.reddit.com/r/abarth/comments/10put7i/fordge_actuator_and_air_intake_question/,1675157906.0,10put7i
258,How many rubber exhaust hangers are on a US Spec Fiat 500 Abarth.,deviousra1n,I know there are the red ones and then the two black ones in the rear not sure how many total or what types?,21,4,0,4,,https://www.reddit.com/r/abarth/comments/10pmhtw/how_many_rubber_exhaust_hangers_are_on_a_us_spec/,1675134523.0,10pmhtw
259,"Live On Cars & Bids, 2013 Abarth",djdbravo,,6,11,0,11,,https://www.reddit.com/r/abarth/comments/10pbb6o/live_on_cars_bids_2013_abarth/,1675106349.0,10pbb6o
260,I bought a new to me 2013 Fiat 500 Abrath with 30k miles. What is the suggested things to do. I ordered spark plugs. Not sure if I need to change the coil packs as well. Is Bosch a good brand? What other maintenance I need to do? TIL,CosmicDust20,,18,6,0,6,,https://www.reddit.com/r/abarth/comments/10lzzyh/i_bought_a_new_to_me_2013_fiat_500_abrath_with/,1674760864.0,10lzzyh
261,Where to mount a fire extinguisher,Bordan-Jelfort69420,"Has anyone any idea on where to mount one of those litte car fire extinguisher? I got mine mounted underneath the passenger seat but I am not quite satisfied with the looks/practicability, since its in the way when you want to move the seat back and forth.

Only thing is: it must be accessible from the drivers seat whithout unplugging the seatbelt.

My car is a 2018 595 Pista.

&#x200B;

Thanks for your ideas!",2,5,0,5,,https://www.reddit.com/r/abarth/comments/10lz4ig/where_to_mount_a_fire_extinguisher/,1674758718.0,10lz4ig
262,I can’t open the passenger door from the outside on my 2014 Abarth - no problems opening it from the inside though. Any ideas? I had the handle replaced earlier this year I’m wondering if the internal mechanism must have broken.,UnitedCaregiver5227,,8,12,0,12,,https://www.reddit.com/r/abarth/comments/10lo0sx/i_cant_open_the_passenger_door_from_the_outside/,1674725346.0,10lo0sx
263,This is Piero - looking forward to warmer weather again for more top-down rides!,mechanicalgrapes,,3,41,0,41,,https://www.reddit.com/r/abarth/comments/10l96un/this_is_piero_looking_forward_to_warmer_weather/,1674679496.0,10l96un
264,"Sold my first 500 Abarth almost 10 years ago, finally back in one.",CanuckWatchFriend,,18,82,0,82,,https://www.reddit.com/r/abarth/comments/10kmsul/sold_my_first_500_abarth_almost_10_years_ago/,1674611283.0,10kmsul
265,I fucking love my car. Wouldn’t trade her for anything,IMakeMyOwnPath,,19,74,0,74,,https://www.reddit.com/r/abarth/comments/10klqtl/i_fucking_love_my_car_wouldnt_trade_her_for/,1674608297.0,10klqtl
266,"90,000 mile milestone today",GoPrO_BMX,,13,31,0,31,,https://www.reddit.com/r/abarth/comments/10kku0p/90000_mile_milestone_today/,1674605749.0,10kku0p
267,Slight backfire at idle,146brim,"I had a P2096 CEL for a while and didn’t have time to get it checked out, and as I was driving today my 2012 500 Abarth started to backfire real bad, shaking the car pretty violently. So I took it into the dealer and was told it needed a ECM software update, which was performed and they will wait to see if the light comes back. I noticed after I took it home there was a very slight backfire still present. Is this normal? Is there a way to fix it?",0,1,0,1,,https://www.reddit.com/r/abarth/comments/10jogp4/slight_backfire_at_idle/,1674510301.0,10jogp4
268,Would you consider this a good deal?,deviousra1n,"I’m looking at a set of OEM Abarth Rims 16” and some used Toyo Observe G3 Ice winter tires with less than 2K on them.


Seller wants $600 do you think this a fair price?",3,1,0,1,,https://www.reddit.com/r/abarth/comments/10jn8mz/would_you_consider_this_a_good_deal/,1674507342.0,10jn8mz
269,Check Engine Light and more boost than normal?,PoweredbyDespair,"Hey guys, so I left work yesterday only to start my car and have it throw a CEL. I drove to work, the car was fine. I parked, worked, and left. Nothing changed. When idling the car sputters just a bit. It isn't a drastic sputter, but definitely enough to notice. I was able to drive the car back home. It actually drive just fine, accelerates fine, and drives normally at speed but the boost is worrying me. I'm making a lot more boost relative to rpm than is normal. When cruising at 55mph before this CEL, you guys know that the boost gauge should be practically sitting at the bottom of the gauge. But now it's at about 4-6psi at about 2-2.5k rpm. It's very odd. This is my first ever turbocharged car, so I really don't know what could have gone wrong to throw this CEL and cause these symptoms. I'm going to have it scanned at an autozone today but I wanted to get some opinions from some other Abarth owners as well.  
I will update this with the codes when I have them!",2,1,0,1,,https://www.reddit.com/r/abarth/comments/10jlz86/check_engine_light_and_more_boost_than_normal/,1674504294.0,10jlz86
270,Transmission/Gearbox Upgrade,Lxn566,"So, Proud owner of a 595 2019... Increasing the power and torque in some days.
Afraid that the increase in power and torque could damage shafts and forks. Are there any upgrades people here have done? share your thoughts please!",2,5,0,5,,https://www.reddit.com/r/abarth/comments/10jj2sr/transmissiongearbox_upgrade/,1674497316.0,10jj2sr
271,Cold start of my stock 595 Pista. Crazy what they did with the Record Monza…,Bordan-Jelfort69420,,7,22,0,22,,https://www.reddit.com/r/abarth/comments/10jgixv/cold_start_of_my_stock_595_pista_crazy_what_they/,1674491244.0,10jgixv
272,The Abarth looks large compared to my MG,bikewrench11,72 MG makes the 500 look large.,4,33,0,33,,https://www.reddit.com/r/abarth/comments/10j4ns5/the_abarth_looks_large_compared_to_my_mg/,1674451065.0,10j4ns5
273,Anyone have this.,Garl1n,,16,2,0,2,,https://www.reddit.com/r/abarth/comments/10j2azk/anyone_have_this/,1674443576.0,10j2azk
274,Follow me home,rick_alvim,Stilo with Abarth cluster from 2000s,0,7,0,7,,https://www.reddit.com/r/abarth/comments/10ir7p7/follow_me_home/,1674414052.0,10ir7p7
275,Picked up this beauty (Snowball II) just before Christmas. Got a question in the comments…,Yakeruaccount,,14,50,0,50,,https://www.reddit.com/r/abarth/comments/10idtwr/picked_up_this_beauty_snowball_ii_just_before/,1674372019.0,10idtwr
276,Tuning,Fifa27,"Hello guys, I currently have a turismo 165hp, I’m looking for tuning it to around 200/215hp what are the mods that I need despite the remap",2,1,0,1,,https://www.reddit.com/r/abarth/comments/10i59hk/tuning/,1674344654.0,10i59hk
277,Possible Water In Oil?,Abarth595Turismo,"Hi all hope someone with a bit more knowledge than me can help!

Checked under the oil cap today and found a fair bit of “mayo”

Coolant levels are fine

Reaches and holds temp fine

Hot air blowing as usual

It’s -1 Celsius in the UK right now so a little “smoke” coming out of the exhaust.

I cleaned it out, took it out for around 30 mins, wiped the tiny amount that had built up, then took it out for about another 45 mins with motorways and getting through the rev range nicely. No loss of power. Still a tiny film of mayo on the cap but a very thin film.

Do you think this could be a head gasket, or just cold weather plus my 10 min drives to work and back everyday?

Usually does get a longer run on the weekend but I haven’t checked under the cap until now.

2018 595 Abarth

Thankyou!",6,1,0,1,,https://www.reddit.com/r/abarth/comments/10i1wyl/possible_water_in_oil/,1674335818.0,10i1wyl
278,My new baby 🫶🏻❤️💛🤍… any mod ideas?,eduardo_345,,18,28,0,28,,https://www.reddit.com/r/abarth/comments/10hv9bf/my_new_baby_any_mod_ideas/,1674318979.0,10hv9bf
279,Skyscraper next to my little Fiat,CosmicDust20,,8,14,0,14,,https://www.reddit.com/r/abarth/comments/10heb9u/skyscraper_next_to_my_little_fiat/,1674261965.0,10heb9u
280,Which is the loudest car; JCW vs 595.,DakotaMyers,"As the title said, in your opinion which is the loudest car? 

595 Competizione with Record Monza exhaust or Mini JCW F56 with Pro Exhaust?",3,0,0,0,,https://www.reddit.com/r/abarth/comments/10gc65l/which_is_the_loudest_car_jcw_vs_595/,1674159860.0,10gc65l
281,Sometimes it is not worth having nice things,SailingSpark,,9,14,0,14,,https://www.reddit.com/r/abarth/comments/10g8or6/sometimes_it_is_not_worth_having_nice_things/,1674151883.0,10g8or6
282,Error Codes When Connected to OBD2,Sad-Blueberry4896,"The last three times I've had my car inspected it starts throwing codes only when the OBD2 is plugged in. I have a 13' 500C Abarth with about 71.5k miles. It is tuned, but I flashed it back to stock for the inspection. It won't pass because of the issues, but they don't ever present otherwise. Once I clear the codes (U110C, U110E, U0002) with my EC handheld, they stay gone. I've checked that the battery is properly secured, but it doesn't seem to have fixed the issue. Does anybody have any advice on this?",6,2,0,2,,https://www.reddit.com/r/abarth/comments/10g8b5f/error_codes_when_connected_to_obd2/,1674151030.0,10g8b5f
283,Low power and bad MPG on stock 55k 2016 Abarth US Spec. No codes. Stock other than alfa 4c coils,mst3kld,"I am down on power. I hit the gas and the boost jumps to 12psi hangs and thinks then steps up to 15psi and tries to creep to 18psi. This is assuming the boost gauge is accurate. I had the lighting bolt come on once, did the throttle reset, did not fix the issue but the light went away. I changed the coils and the sparks and nothing changed. Took it to my mechanic and said it most likely the throttle body but wanted to post before I went and bought the parts.
Granny driving gets me like 25mpg when normal driving was 27mpg.",17,2,0,2,,https://www.reddit.com/r/abarth/comments/10g4z4c/low_power_and_bad_mpg_on_stock_55k_2016_abarth_us/,1674143242.0,10g4z4c
284,Question/Advise. New to Abarth.,MeasurementVivid3720,"Recently picked up a 2012 Abarth and is missing a line right here, what does it go to? Any information/help is appreciated. Ty.

https://preview.redd.it/fsytk3i17vca1.jpg?width=640&format=pjpg&auto=webp&v=enabled&s=a42f7a1b8675f4e19646150a3abbaf65ccb670b2",4,3,0,3,,https://www.reddit.com/r/abarth/comments/10fib0p/questionadvise_new_to_abarth/,1674074984.0,10fib0p
285,Joined the gang today,CheifLips,,22,86,0,86,,https://www.reddit.com/r/abarth/comments/10fhp05/joined_the_gang_today/,1674073529.0,10fhp05
286,What do you run for HID headlights?,PowerWagon106,"I will not go LED because I have been through 3 sets of ""top rated"" brands and each were dimmer than the damn halogens, partially due to PWM and partially due to the blind spots of the LED pattern.  So I am going HID on my 2012 Abarth 500.  What kits have you guys been successful with?",17,2,0,2,,https://www.reddit.com/r/abarth/comments/10fdy93/what_do_you_run_for_hid_headlights/,1674064775.0,10fdy93
287,"1959 Fiat Abarth 750 ""Double Bubble"" Zagato",Pkd2,,8,27,0,27,,https://www.reddit.com/r/abarth/comments/10d2wre/1959_fiat_abarth_750_double_bubble_zagato/,1673837120.0,10d2wre
288,Tuning 2015 595 Abarth,Logical_115,"So I have been doing a bit of researching around but haven’t found definitive answer on this question, how do you make 200 hp with pops and bangs tune? Figured maybe you guys could help me out.",6,1,0,1,,https://www.reddit.com/r/abarth/comments/10d06of/tuning_2015_595_abarth/,1673829582.0,10d06of
289,"Abarth 595, 2 or 4 exhaust pipes difference?",OPINION_IS_MINE,"Hi Reddit,

I am looking to buy my first Abarth 595. Unfortunately, dealers and garages here don't have the best reputation and often like to rebadge or say that a car is a certain special edition when it's not. Most of the listings say Competizione and from what I can tell they actually are.
All the models I'm looking at are listed as 2020-2022 but I noticed some have 2 exhaust pipes and another has 4 exhaust pipes. Could someone tell me the difference?",8,2,0,2,,https://www.reddit.com/r/abarth/comments/10chyqm/abarth_595_2_or_4_exhaust_pipes_difference/,1673783437.0,10chyqm
290,Intake is driving me crazy,Apart_Cockroach_5520,"Just purchased a 595 comp with a tune and forge intake kit but the intake noise going up hills on boost is unbearable, are there any kits with more sound baffling? Otherwise, how restrictive is the factory box? Car is 140fwkw with custom downpipe and fmic",5,3,0,3,,https://www.reddit.com/r/abarth/comments/10c4b00/intake_is_driving_me_crazy/,1673739487.0,10c4b00
291,Fitted my new Essesse wheels (top pic). Is putting these wheels on a non-Essesse pack car like putting an M badge on a non-M BMW? ( I really like the way they look 😀).,vanrayhodginski,,12,31,0,31,,https://www.reddit.com/r/abarth/comments/10c2blw/fitted_my_new_essesse_wheels_top_pic_is_putting/,1673734906.0,10c2blw
292,Will I need a spacer and wobble bolts to make these work?,Link1313,After doom scrolling and keep seeing these I am intrigued by these. It was either these or an all black set. However my decision will be made on a particular issue. If I can make these work with spacers or wobble bolt kit that would be fine. However I’m worried it won’t fit right around the calipers or won’t sit right in particular. Like I said my decision is based on how much of a pain it will be due to the other being spot on spec size,1,0,0,0,,https://www.reddit.com/r/abarth/comments/10bdqgz/will_i_need_a_spacer_and_wobble_bolts_to_make/,1673665537.0,10bdqgz
293,Beats sub replacement/ upgrade,Bryson101604,The beats subs on my 2013 abarth is starting to go bad does anyone know of a alternative or stock replacement that would be relatively easy to swap into the sub box haven’t had much success shopping online,17,1,0,1,,https://www.reddit.com/r/abarth/comments/10b8juy/beats_sub_replacement_upgrade/,1673651334.0,10b8juy
294,would someone help me tune my car?,Relevant_Bandicoot80,"I'm curious if anyone would share their tuning chip with me? I'm not sure if they can be used on multiple cars, but I've been wanting to run the abarth tune on my 500 turbo for a while but I cannot afford to buy one, especially for just the one time use, so I'm wondering if I could use someone's, tune my car and send it back to you or maybe we could meet up? I live in Albuquerque, NM. It would be greatly appreciated, I've gotten a lot of help in this forum for my little car",9,1,0,1,,https://www.reddit.com/r/abarth/comments/10b7uza/would_someone_help_me_tune_my_car/,1673649602.0,10b7uza
295,need help with a decision,DamUCat,"ive been looking for a new sports car and want something italian, mostly im gonna be fucking around in the rain and carving whatever curvy backroads i can find. my current #1 choice is an abarth 124 spider however 170 horsepower just aint enough for me. about what would i need to do to squeeze an extra 100 horsepower out the motor, or would something like a giulia qv or used granturismo be a better idea.",12,1,0,1,,https://www.reddit.com/r/abarth/comments/10b556b/need_help_with_a_decision/,1673643016.0,10b556b
296,"Got new (to me) wheels today, after several hours cleaning, they are ready to go on - except it’s now dark.",vanrayhodginski,,5,51,0,51,,https://www.reddit.com/r/abarth/comments/10b1n4x/got_new_to_me_wheels_today_after_several_hours/,1673634487.0,10b1n4x
297,Help With Ideas As To Why Car Won't Start - Low Battery + Electronic Throttle Control Warning Light,HipHopHistoryGuy,"Hi all. My 2013 Fiat 500 Abarth Cabriolet manual transmission with 68,000 miles has been in the shop since Jan. 4, 2023 with the following situation and wondering if anyone could assist with any expertise as to what can be going on.

**Below is what occurred:**

* Driving home on one hour drive via highway.
* Two miles before home, dash ""battery charging system light"" (battery icon) goes on/off approx. every 15 seconds
* One mile before home, dash ""electronic throttle control warning light"" (lightning bolt icon) goes on/off approx. every 15 seconds.
* 1/2 mile before home both lights remain solid and not randomly blinking on/off.
* Pull into local garage which is open. Engine begins sputtering a bit.
* Negative cable on battery was a bit loose (I had switched battery myself 6 months ago). Mechanic tightens negative battery cable to battery. Car turns off (I believe we turned off engine and it didn't stall)
* Car will NOT turn back on. Car has power but engine is not cranking.
* EDIT (added): Battery is checked and is outputting proper voltage.
* Mechanic checks for codes which supposedly resets the computer system in the process. I recall him saying multiple codes were showing up and to leave the car. Tech believes it's the starter since the engine won't crank.
* Mechanic calls - says the starter needs to be replaced. Cost $600 USD w/ labor.
* Mechanic calls - starter replaced and apparently needed replacement, however it did not fix the issue.
* They are now getting a code pointing to the alternator so they are testing the alternator for improper voltage.
* Mechanic believes it could be the alternator but hoping it's not the ECU.

**Notes:** Car has a 500 Madness ECM piggyback as well as a GoPedal.

My questions for the experts here is does the diagnosis so far seem correct? I really don't want to go bankrupt trying to get my beauty fixed if I should be going to a different mechanic who specializes in Fiat. I'm concerned they will repair the alternator and then tell me it didn't fix the issue and loop will continue. The closest Fiat dealer from me is 20 miles away and I would need to have it towed there since the car won't start.

Also, I am 8 miles west of Boston. If anyone is in this area and swears by their mechanic, I could use any recommendations for either this or future repairs. Thank you for reading and any assistance.

**UPDATE 1/20/23:** Mechanic called and new starter was broken. Tried another one - also broken. Tested both starters outside of the car and they work. Tested my original starter outside of the car and **IT WORKED**. Put starter back in my car and would not turn on. Apparently, there is a tricky way regarding the wiring to power the starter which was not set correctly. Once this was figured out after several phone calls from my mechanics to others, the car turned on without issues! He replaced the negative terminal to the battery as apparently it was having trouble staying tight.

With that said, we will do not know why the car would not turn back on when I originally brought the Abarth to the mechanic with the two dash lights on. I do believe those two lights originally went on from a loose negative terminal to the battery. However, after tightening the negative terminal and clearing out the ECU's codes, the car should have cranked the starter and turned on but it did not. My only guess is there was some sort of safety initiated that prevented the clutch sensor or ignition sensor from allowing the starter to crank? I'll be keeping an eye on it over the next week to see if anything odd occurs but crossing my fingers.",8,3,0,3,,https://www.reddit.com/r/abarth/comments/10aw71o/help_with_ideas_as_to_why_car_wont_start_low/,1673620961.0,10aw71o
298,A-Pillar mounted performance gauges,DeltaWing12,Has anyone done a-pillar mounted triple gauge setup? Looking to add that to my cabrio and could use some help on where to find trim pieces in particular.,1,0,0,0,,https://www.reddit.com/r/abarth/comments/10alm3y/apillar_mounted_performance_gauges/,1673585638.0,10alm3y
299,Looking to buy abarth 595 UK,Lxn566,"South London, kent or anywhere closeby 

&#x200B;

MUST BE: 

\- Manual 

\- Clean MOT

\- 2016 or above 

&#x200B;

Preferably 

Silver/Gray or Yellow 

Comment, dm me here and we will communicate via messenger",3,1,0,1,,https://www.reddit.com/r/abarth/comments/108cgc7/looking_to_buy_abarth_595_uk/,1673364291.0,108cgc7
300,Ugh! Might have to sell her.,Milnoc,,12,28,0,28,,https://www.reddit.com/r/abarth/comments/108bnyi/ugh_might_have_to_sell_her/,1673362271.0,108bnyi
301,Issue with noise and it’s not the exhaust,Viscovitz,"So, as per the title. I’ve had my 2018 595 for about a year and the last couple months it has started making a droning noise when driving. I’ve had 3 mechanics look at it and they can’t find a problem with the exhaust so it’s not that. I don’t think it’s a wheel bearing cause it’s not a knocking noise. Just a constant high pitched drone that’s louder than the exhaust. Anyone any ideas before I drop a fortune to have it stripped down?",11,6,0,6,,https://www.reddit.com/r/abarth/comments/107lq14/issue_with_noise_and_its_not_the_exhaust/,1673288687.0,107lq14
302,Scorpion catback,GuideIcy3073,"Hello, I'm looking to buy a non resonated scorpion cat back system and was wondering if anyone has one and what they think of it, also if anyone cam point me in the right direction of hearing one on an abarth I can't really find any clips with the stock cat only decat clips",0,1,0,1,,https://www.reddit.com/r/abarth/comments/107im0u/scorpion_catback/,1673281552.0,107im0u
303,Picked this up this morning! 63 plate supersport.,olliebarrow_,,5,42,0,42,,https://www.reddit.com/r/abarth/comments/106w9ak/picked_this_up_this_morning_63_plate_supersport/,1673216541.0,106w9ak
304,Timing belt change on 2015 Fiat 500 Abarth 33K miles,Fit_Photograph_7015,,6,2,0,2,,https://www.reddit.com/r/abarth/comments/106cg0n/timing_belt_change_on_2015_fiat_500_abarth_33k/,1673160779.0,106cg0n
305,"Black wheels with yellow accents, hot or not?",Zadddyyyyyy,,23,89,0,89,,https://www.reddit.com/r/abarth/comments/10645f7/black_wheels_with_yellow_accents_hot_or_not/,1673136695.0,10645f7
306,climate control not functioning properly,abarth_23,"Live in Southern California and went away for two weeks,  heavy rains while I was away and car was outside in the driveway
 I have a 2012 abarth with auto climate control and worked perfectly fine last time I drove it. Started car and driving around and climate control just blows hot air throughout the vents and changed the settings and same hot air only.  I don't hear the compressor cycling in either
 Any thoughts??! Thanks",8,1,0,1,,https://www.reddit.com/r/abarth/comments/1063g80/climate_control_not_functioning_properly/,1673134962.0,1063g80
307,Trans swap,Link1313,"So I was trolling deep about the abarth and found out the engine fits in several model vehicles. Which is nice to know if I blow one but my curiosity is peaked a bit though. If my understanding is right, could it be possible to swap out the 6 speed from the day the dodge dart into the abarth? Would like to have that extra gearing. If not what transmission would work better than the standard in a ‘13. Figures since the clutch is being finicky going into reverse now that I might want options when it goes fully",10,2,0,2,,https://www.reddit.com/r/abarth/comments/1062mhg/trans_swap/,1673132910.0,1062mhg
308,How to know if the 595 comp have an lsd?,TheKebap,"I want to but a used 595 competizione from a person, when I asked if it had an lsd, the seller said that he doesn’t know. So I was wondering is there any way to indicate if the car has an lsd or not?",3,3,0,3,,https://www.reddit.com/r/abarth/comments/1060dh3/how_to_know_if_the_595_comp_have_an_lsd/,1673127307.0,1060dh3
309,Has anybody upgraded their rear torsion bar? If so where did you get it and how big of a difference does it make?,Independent_Sky_517,,25,7,0,7,,https://www.reddit.com/r/abarth/comments/1058let/has_anybody_upgraded_their_rear_torsion_bar_if_so/,1673046415.0,1058let
310,Has anybody had any experience with the billstein b14 coilovers?,Independent_Sky_517,Would you recommend them for track use and are there any other setups that are better? In the UK. Gracias.,5,2,0,2,,https://www.reddit.com/r/abarth/comments/1057ry2/has_anybody_had_any_experience_with_the_billstein/,1673044474.0,1057ry2
311,Any love for the old Abarths?,RuinAccomplished6681,,11,73,0,73,,https://www.reddit.com/r/abarth/comments/104tsl3/any_love_for_the_old_abarths/,1673010518.0,104tsl3
312,Best wiper blades?,deviousra1n,"Need some recommendations on the best wiper blades for our cars, anyone tried the PIAA blades, I have some Bosch icons on but they already streaking after a month of them. Windshield is clean and the blades make good contact, I got better performance out of Amazon blades.

Just curious what everyone uses?",24,5,0,5,,https://www.reddit.com/r/abarth/comments/104622n/best_wiper_blades/,1672943039.0,104622n
313,MTA Gearbox Remap,Greedy_Box_7167,I was thinking of remapping my MTA gearbox to improve the shifting and was wondering if anyone here had done so. If so could you tell me how it went and if you recommend it.,5,0,0,0,,https://www.reddit.com/r/abarth/comments/103u4r6/mta_gearbox_remap/,1672908465.0,103u4r6
314,Italian Stallion,obloq300,,18,59,0,59,,https://www.reddit.com/r/abarth/comments/1038klc/italian_stallion/,1672851491.0,1038klc
315,Best Wheel Bearings both front and rear?,JohnathanGower,"Looks, or rather it SOUNDS like I will need to replace my wheel bearings soon. There appear to be many options...what are the best bearings for the Abarth?  Who makes the stock ones and are there better ones out there?  I have a 2013 Abarth and I''m in the U. S.",6,1,0,1,,https://www.reddit.com/r/abarth/comments/102ynar/best_wheel_bearings_both_front_and_rear/,1672822517.0,102ynar
