,title,author,text,numcm,ups,downs,score,likes,link,time,id
697,In need of advice,bsalamander,"Hi guys! As you may have seen I just got my first Abarth. She spent all of her life in the warm climates of the South and now is in Wisconsin, which if you don’t know, have awful winters. She has no rust due to her previous lives and I am determined to prevent that- especially on her underbody. Does anyone have advice? Right now I’m debating doing a thorough wash all around & under before winter and just going to a touch less car wash regularly throughout.",16,2,0,2,,https://www.reddit.com/r/abarth/comments/wiybzn/in_need_of_advice/,1659929386.0,wiybzn
698,"Hello, my car at the cold start was failing, I changed the spark plugs and the coils, after 2/3 months it started to do it again, I only use the best fuel, it’s a 595 turismo any help? Thx",Mr_Felicio,,1,2,0,2,,https://www.reddit.com/r/abarth/comments/wixd52/hello_my_car_at_the_cold_start_was_failing_i/,1659926484.0,wixd52
699,Anyone have any idea what can cause this,Kelvinbtw,Anyone have any idea what these could possibly mean. I did over fill the engine with oil once could be that .,7,4,0,4,,https://www.reddit.com/r/abarth/comments/wiuccb/anyone_have_any_idea_what_can_cause_this/,1659917718.0,wiuccb
700,Change AC Controls.,Lemonwedged,"Hi peeps. 

I’ve just gotten my 2017 Abarth. But it is base model. I’d like to change AC controls from old to new. Is it possible? What’s needed?",19,14,0,14,,https://www.reddit.com/r/abarth/comments/wie4xt/change_ac_controls/,1659873738.0,wie4xt
701,Everyone meet Andy!!! She is my first car. I’ve been saving up for her for about 11 months now and it’s finally paid off. Isn’t she a beaut? I’m finally apart of the family!!,bsalamander,,39,121,0,121,,https://www.reddit.com/r/abarth/comments/wi42wc/everyone_meet_andy_she_is_my_first_car_ive_been/,1659837160.0,wi42wc
702,Identifying a part,holopox5,"I'm wondering if someone can help me identify the missing screws or fasteners underneath the plastic front lip of my 2018 Abarth. It looks like there are three missing from mine which is causing the plastic piece to sag. 

It's the three in the [middle](https://imgur.com/8xLVPJU)",3,5,0,5,,https://www.reddit.com/r/abarth/comments/whx7sh/identifying_a_part/,1659817043.0,whx7sh
703,124 Spider Pilot Bearing?,throwaway55323,"I’m ordering parts to replace my clutch and was looking for the Pilot Bearing for the Flywheel to crankshaft attachment. But I can’t find anything on Mopar/elsewhere, nor see it on any parts diagram.

Does the spider not use one? Or is it called something else?

Also anyone have any parts sites they like to order from besides Mopar?",0,2,0,2,,https://www.reddit.com/r/abarth/comments/whhmw4/124_spider_pilot_bearing/,1659767919.0,whhmw4
704,Selling some stuff.,MetalMattyPA,,30,14,0,14,,https://www.reddit.com/r/abarth/comments/wh6s6z/selling_some_stuff/,1659734616.0,wh6s6z
705,Check Your Air Filter,,"I live out in the boonies where we have critters who look for warm out of the way places in the winter. Every year I put electric mouse traps under the hood of my vehicles to keep them from chewing wires.

It was time to replace the air filter on my 2017 Abarth. and when I took the red cover off to replace it I found this.  This could have been a very expensive bill but I was blessed that it wasn't.  If you live out in the woods like I do, I highly recommend checking your air filter.  I vacuumed all the little nut casings and installed a new filter.

https://preview.redd.it/g0n96zvcgsf91.jpg?width=3840&format=pjpg&auto=webp&v=enabled&s=a8e7e0f2f6a66a7751240d29eaf4525b3b7d0e44",3,9,0,9,,https://www.reddit.com/r/abarth/comments/wggpf9/check_your_air_filter/,1659658797.0,wggpf9
706,My little buzz bomb,Daffy1275,Had her two years love her to pieces!! Just stainless exhaust and new suspension and I'm done tinkering.,9,53,0,53,,https://www.reddit.com/r/abarth/comments/wgdpsj/my_little_buzz_bomb/,1659650857.0,wgdpsj
707,"There she is, my new to me 2015 Abarth 595C Turismo",NatuAurora,,2,24,0,24,,https://www.reddit.com/r/abarth/comments/wfvw63/there_she_is_my_new_to_me_2015_abarth_595c_turismo/,1659602148.0,wfvw63
708,Route 66,confirmamcolorblind,,3,33,0,33,,https://www.reddit.com/r/abarth/comments/wfvf3i/route_66/,1659600323.0,wfvf3i
709,Portuguese abarth 595c ⚡️,Mr_Felicio,,8,24,0,24,,https://www.reddit.com/r/abarth/comments/wfoy27/portuguese_abarth_595c/,1659578851.0,wfoy27
710,Some AI generated images of Abarths,norgan,,3,17,0,17,,https://www.reddit.com/r/abarth/comments/wfjunu/some_ai_generated_images_of_abarths/,1659565150.0,wfjunu
711,Help,A_hot_thick_man,Thanks for the help on the last one I looked on the Mot history thing and it looked good but do you think it’s realsonably priced,5,8,0,8,,https://www.reddit.com/r/abarth/comments/wfjsw6/help/,1659565036.0,wfjsw6
712,Abarth 595 OPF/GPF??,EnvironmentalPay2271,"Hey there, 

I was wondering if anyone of you guys knows if the current Abarth 595s do haven an OPF/GPF. 

Cause i recently wanted to get my car stage 1 mapped and the tuner told me he cant  because its got an OPF/GPF. 

FYI ive got an 2022 F595  and as far as i knew or atleast thought  it does not have an OPF/GPF. 

I also gave my Dealer a call and they told me the same. 

Im Located in Europe if anyone is wondering. 

Thanks in advance.",2,1,0,1,,https://www.reddit.com/r/abarth/comments/wfiv73/abarth_595_opfgpf/,1659562720.0,wfiv73
713,"yes, he needs a bath. but it wont stop me from taking a picture of him sitting under the late July monsoon sun☀️",welldamnitjerry,,10,42,0,42,,https://www.reddit.com/r/abarth/comments/wfacld/yes_he_needs_a_bath_but_it_wont_stop_me_from/,1659542467.0,wfacld
714,The morning sun hits her just right,waurma,,6,36,0,36,,https://www.reddit.com/r/abarth/comments/wezjnv/the_morning_sun_hits_her_just_right/,1659509946.0,wezjnv
715,Help,A_hot_thick_man,I’m looking at a first car any advice on this,16,11,0,11,,https://www.reddit.com/r/abarth/comments/wercx3/help/,1659485071.0,wercx3
716,P0299 Check Engine Light- 2012 Fiat 500 Abarth,146brim,"I’ve been having what seems like a pretty typical issue, where the car will limit itself to 6 psi of boost, then it will go away after I turn off and on the car. Is there any direct fix for this? It really isn’t creating any problems, just annoying. Thanks",10,0,0,0,,https://www.reddit.com/r/abarth/comments/we0t4x/p0299_check_engine_light_2012_fiat_500_abarth/,1659410324.0,we0t4x
717,Radio question,azebod,"My headunit died, and even if the part wasn't out of stock with no ETA for restock, I have had enough cases of it being glitchy that I'd rather not pay to have it replaced with another of the same buggy model.

Searching posts here seems to indicate that aftermarket units have issues with the steering wheel buttons, but honestly I forget they are there anyway, is there any other potential loss from replacing the unit with something else?

Honestly the biggest thing I would like to keep working is the USB slot near the cupholder allowing interfacing with ipods so I don't have to deal with using my phone (it doesn't have memory expansion and it's easier than dealing with bluetooth anyway) but as long as there is some form of AUX interface I can probably deal ok. If anyone has suggestions of ones that worked well for them it'd be appreciated. (car is an american 2017 abarth 500)",4,2,0,2,,https://www.reddit.com/r/abarth/comments/wdphu6/radio_question/,1659380607.0,wdphu6
718,Possibly have to get rid of the pod racer,VVULFPELT,"Well guys, the day has come.  My ac is leaking, I’m popping an engine code, and my passenger side window is broken.  I’m looking at quite a bit in terms of repairs and, I hate to say it, but I don’t know if I’ll be able to keep my beloved Dalia Nera.  I just got her two months ago and I’ve loved every second of driving my dream car, but I don’t know if I’ll be able to afford these repairs",7,5,0,5,,https://www.reddit.com/r/abarth/comments/wdolc3/possibly_have_to_get_rid_of_the_pod_racer/,1659378382.0,wdolc3
719,shout-out to bigturboabarth for the giveaway,Euro2ner,,5,24,0,24,,https://www.reddit.com/r/abarth/comments/wdm5tb/shoutout_to_bigturboabarth_for_the_giveaway/,1659372402.0,wdm5tb
720,Do I need a new wastegate solenoid or can I just upgrade the vacuum hoses?,deviousra1n,"Hey! So I am chasing a boost leak and I wanted to replace the vacuum lines to make sure there are no cracks since I have had a turbo underboost code recently. I was wondering I need to buy a entire new wastegate solenoid or if I can just upgrade the vaccum lines on my existing one?

Thanks

Links to parts for reference:

https://shopeurocompulsion.net/products/genuine-fiat-abarth-500t-wastegate-solenoid

https://shopeurocompulsion.net/products/eurocompulsion-silicone-vacuum-line-kit",2,3,0,3,,https://www.reddit.com/r/abarth/comments/wd7w3t/do_i_need_a_new_wastegate_solenoid_or_can_i_just/,1659327115.0,wd7w3t
721,Cleaning interior of Competizione,turbo1aser,"Hi I'm trying to determine which kind of cleaner to use. My guess is the following is real leather:

1. Guard above cluster panel
2. Panel in middle of door
3. Embroidered trunk cover
4. Steering Wheel
5. Inner park of seat and headrest
6. Rear seats

Did I miss anything?

Any recommended non scented cleaners for the following?

1. Plastics
2. Leather
3. Carpet",1,4,0,4,,https://www.reddit.com/r/abarth/comments/wd6vth/cleaning_interior_of_competizione/,1659323918.0,wd6vth
722,Purchased a 2015 Abarth and it's the funnest car I have ever owned... but there are 3 things bugging me... can you help?,twoshooz,"1. The arm rests are driving me nuts. When I'm driving and shifting through gears, my right arm sits right \*between\* the two arms rests, so each of them is pushing its nubby little bits into my arm from different angles. Those things are the size of hot dogs and the texture of a little kid's red plastic baseball bat. Has anybody found a solution to this? I don't even know what that would be...
2. Similarly, I drive with my left arm up and hand on the top of the steering wheel. This causes the seat belt to dig into the side of my neck. It feels like there is a little line of fire ants marching back and forth. Again, I don't know what the solution could be (I've tried to change body positions, move the seat around, etc)...
3. I listen to music from my phone through bluetooth. I have to turn the volume up on the head unit quite a bit to hear at a good level. But every time I get back into the car, the stereo has defaulted to the ""tuner"" which blasts whatever shitty FM station it is tuned to and makes me want to yell bad words. Am I missing something in the menu that will allow it to remember the last thing it was on (bluetooth) instead of assaulting me with Ted Nugent and static at high volume? Anything I can do about this other than replace the whole dumb fucking thing?

Other than those things, I can't get enough of this car. It is a whip-cracking good time.",12,8,0,8,,https://www.reddit.com/r/abarth/comments/wd5izx/purchased_a_2015_abarth_and_its_the_funnest_car_i/,1659319799.0,wd5izx
723,Engine Bay: X2 Lithium Battery!,QuiteContray,,19,32,0,32,,https://www.reddit.com/r/abarth/comments/wd052a/engine_bay_x2_lithium_battery/,1659304671.0,wd052a
724,Question about 1.4 Multiair oil level,Rodzp,"I have a car with the 1.4 Multiair engine. Today I checked the oil level and the dipstick was dry. However, the oil pressure light didn't turn on (even though it's working on start up), and I drove a bunch of km in the meantime and never has any light come on. Also when I finish driving there is some oil on the stick always. Should I worry?",10,4,0,4,,https://www.reddit.com/r/abarth/comments/wcwau1/question_about_14_multiair_oil_level/,1659294527.0,wcwau1
725,Bombardone vs Bugatti,Old_Entrepreneur6019,,1,23,0,23,,https://www.reddit.com/r/abarth/comments/wcif02/bombardone_vs_bugatti/,1659250092.0,wcif02
726,Suspension question.,Ahzuo-1,So I've decided to stop delaying and get new shocks and struts for the 500 abarth and I was wondering if koni yellows were the way to go or if there is something more well liked. I don't believe I need new springs as the previous owner seems to have added lowering springs as one of the things they did (didn't realize that until I saw pictures of other abarths having a little more wheel gap and the fact that my car felt like it scraped more than it should've when I was getting used to it.) I just want to give my little scorpion the suspension it needs to not make the not so nice clonks anymore.,14,5,0,5,,https://www.reddit.com/r/abarth/comments/wcf027/suspension_question/,1659237976.0,wcf027
727,Check engine light. O’rileys OBD scanner wasn’t able to detect a code.,Mean-Type2355,"Cleared it, engine light came back on a few days later. Car runs and drives fine. Other than a fiat dealership, which auto stores/shops have you guys found luck with regards to Abarth diagnosis and work? 500 Madness in Long Beach,CA is booked out for a few months. It’s a ‘13 Abarth with 40k miles. All fluids are close to max, gas cap is properly tightened. Oil change performed 1k miles ago. All lights and electronics work fine.",15,8,0,8,,https://www.reddit.com/r/abarth/comments/wbo8az/check_engine_light_orileys_obd_scanner_wasnt_able/,1659153824.0,wbo8az
728,"Ok, now what?",irescueducks,,7,9,0,9,,https://www.reddit.com/r/abarth/comments/wb45h0/ok_now_what/,1659099512.0,wb45h0
729,"Will this aftermarker radio with ""Steering Wheel Learning"" work with Abarth 2013?",wanabean,"Hi, found this in ebay:

[https://www.ebay.com/itm/234386368600](https://www.ebay.com/itm/234386368600)

It says  has: *5.Steering Wheel Learning: Through it you can control the functions you need by steering wheel, more convenient*

Does anyone know if this will save of buying a steering wheel adapter like Axxess ASWC-1?",2,0,0,0,,https://www.reddit.com/r/abarth/comments/wanqkl/will_this_aftermarker_radio_with_steering_wheel/,1659048283.0,wanqkl
730,My first car 😳👌,LitooD,,11,67,0,67,,https://www.reddit.com/r/abarth/comments/wahwso/my_first_car/,1659034233.0,wahwso
731,Mine! Been waiting for 10 years..,omerbonfil,,15,94,0,94,,https://www.reddit.com/r/abarth/comments/wa7v61/mine_been_waiting_for_10_years/,1659009123.0,wa7v61
732,Welcome!,Migg_isalreadytaken,,2,17,0,17,,https://www.reddit.com/r/abarth/comments/wa7fbz/welcome/,1659007783.0,wa7fbz
733,Abarth aluminium gear knob removal help,Funny-Fruit-2605,"Hey everyone, I can’t seem to find a video online that shows how to remove the aluminium ball gear knob on the 595.

Wanted to do this as im putting a biposto knob with an adapter 

Any help is appreciated",0,3,0,3,,https://www.reddit.com/r/abarth/comments/wa2laz/abarth_aluminium_gear_knob_removal_help/,1658991198.0,wa2laz
734,124 Spider: How many hours for mechanic to replace the clutch?,throwaway55323,"Has anyone had a clutch replaced on their 124? Or just knows enough to have an idea on how many hours a professional mechanic will need to replace it? 

I have a Fiat shop quoting me 7.5 hours at $200+/hr, both of which seem way high. Debating just taking it to a Miata shop but figured I’d check here in case my assumption is wrong.",4,3,0,3,,https://www.reddit.com/r/abarth/comments/w9xkcf/124_spider_how_many_hours_for_mechanic_to_replace/,1658975564.0,w9xkcf
735,Mirror covers and lip replacement,Suzlapulfo,,4,12,0,12,,https://www.reddit.com/r/abarth/comments/w9bgoz/mirror_covers_and_lip_replacement/,1658918863.0,w9bgoz
736,"Anyone have a 124 Spider near Winston, NC?",Bonkzzilla,"The wife and I are cautiously considering one of these but the first question is whether I would fit comfortably, at 6'1, and now that there are no more on new car lots I would love to find someone who had one and was willing to let us, well, sit in it and see how we like it, with an eye towards shopping for one.  Anyone in central NC?",8,3,0,3,,https://www.reddit.com/r/abarth/comments/w97bc7/anyone_have_a_124_spider_near_winston_nc/,1658903620.0,w97bc7
737,"Currently thinking about trading my 2014 Mazda 3 for a little Abarth. I’m used to have a touch screen with nav etc., the Abarth in this price range doesn’t have that… any suggestions for me? Is this a big downgrade?",benidol,,34,23,0,23,,https://www.reddit.com/r/abarth/comments/w8uuax/currently_thinking_about_trading_my_2014_mazda_3/,1658868937.0,w8uuax
738,What a glorious noise,richardsenna,,2,25,0,25,,https://www.reddit.com/r/abarth/comments/w8szs6/what_a_glorious_noise/,1658864483.0,w8szs6
739,Ownership cost?,BigPawzBrett,"I’ve currently got a 2004 Mini Cooper S, but a dealership near me has a 2012 500 abarth with 40k miles that is reeeeally tempting me to sell the mini. I’ve had almost no issues out of the mini and am wondering what problems I should look for if I were to buy the abarth? Everyone tells me that they’re expensive to own, but they said the same about the mini and I’ve had no problems with it. TIA!",7,3,0,3,,https://www.reddit.com/r/abarth/comments/w8rbtx/ownership_cost/,1658860445.0,w8rbtx
740,"Currently trying to buy a 500 abarth, need some help from someone that has one or has had one!!!",PoweredbyDespair,"Hey guys, so I'm currently talking with a dealership out of my state trying to purchase a 500 abarth. I will be buying it sight unseen, so I'm trying to take everything I can into account. I had the sales guy send me a video of it starting up and running. I was hoping someone that has a 500 abarth or has had one in the past can help me by telling me if that engine sounds healthy. It sounded a little bit off to me, almost a little knocky. It has only 30k miles.[https://www.youtube.com/watch?v=Ph8wAn0lFGU&t=1s](https://www.youtube.com/watch?v=Ph8wAn0lFGU&t=1s)",35,6,0,6,,https://www.reddit.com/r/abarth/comments/w8og0g/currently_trying_to_buy_a_500_abarth_need_some/,1658853534.0,w8og0g
741,"430€ front rotors + 216€ for pads, nearly had a heart attack 😰just for the parts 😱 595 competizione",,,15,3,0,3,,https://www.reddit.com/r/abarth/comments/w8lr7w/430_front_rotors_216_for_pads_nearly_had_a_heart/,1658847047.0,w8lr7w
742,DRAWING WINNER - EURO2NER!!!,BigTurboAbarth,,8,16,0,16,,https://www.reddit.com/r/abarth/comments/w7x3b9/drawing_winner_euro2ner/,1658775496.0,w7x3b9
743,Need help finding out what this sound is ? I’m thinking of the absolute worst maybe it’s a rod knocking,Primary-Amoeba-1736,,5,1,0,1,,https://www.reddit.com/r/abarth/comments/w7eoao/need_help_finding_out_what_this_sound_is_im/,1658721300.0,w7eoao
744,Typical Abarth owner for sure,Zadddyyyyyy,,4,14,0,14,,https://www.reddit.com/r/abarth/comments/w7ej5x/typical_abarth_owner_for_sure/,1658720849.0,w7ej5x
745,Made it through paint last night,52willys,,1,14,0,14,,https://www.reddit.com/r/abarth/comments/w72400/made_it_through_paint_last_night/,1658686785.0,w72400
746,Here’s how it turned out,Zadddyyyyyy,,24,25,0,25,,https://www.reddit.com/r/abarth/comments/w6z6x0/heres_how_it_turned_out/,1658679151.0,w6z6x0
747,Update!,QuiteContray,,6,32,0,32,,https://www.reddit.com/r/abarth/comments/w6p7w4/update/,1658644854.0,w6p7w4
748,"Pro tip, plastidip as a base coat + clear coat as a top coat = extremely durable high gloss paint that’s extremely forgiving, minimal prep and sticks to any surface, been doing it for years. (No longer removable though)",Zadddyyyyyy,,12,11,0,11,,https://www.reddit.com/r/abarth/comments/w6fd7v/pro_tip_plastidip_as_a_base_coat_clear_coat_as_a/,1658613657.0,w6fd7v
749,Maybe I should’ve gotten BGSWTTR as my plate,matt-ross,,2,27,0,27,,https://www.reddit.com/r/abarth/comments/w62mqv/maybe_i_shouldve_gotten_bgswttr_as_my_plate/,1658578510.0,w62mqv
750,"Just bought the beauty to the left, after having the beauty to the right for two years. The amount of smiles per miles are off the charts!!!",Soldato_Di_Soldi,,9,64,0,64,,https://www.reddit.com/r/abarth/comments/w5q2ar/just_bought_the_beauty_to_the_left_after_having/,1658536326.0,w5q2ar
751,What are the brake pad intervals for a base Abarth 595?,vanrayhodginski,"So my 2019 Abarth 595 145 base model has 18200 on the clock. Pads are original, and were on 5mm front and rear when I got it at 13700 miles.

80% of my journeys are motorway/highway. So I’m wondering if/when I should just get the pads changed out.",6,3,0,3,,https://www.reddit.com/r/abarth/comments/w5ieg0/what_are_the_brake_pad_intervals_for_a_base/,1658516359.0,w5ieg0
752,TD04 Kit - Where to buy/What to buy,CategoricHummus,"Hey All,

I want to slap on a TD04 kit on the nugget, but im not sure of who I should go through to buy it (TMC?). I'm in the states and most on offer are overseas.  Any recommendations are appreciated! Also, Any thing i should buy or stay clear of? I already installed the EC +1 upgraded turbo but im looking to give this setup a go. Any help is always appreciated!",3,1,0,1,,https://www.reddit.com/r/abarth/comments/w5hm7o/td04_kit_where_to_buywhat_to_buy/,1658514369.0,w5hm7o
753,"Cousins hanging at work, Abarth is mine.",coopnjaxdad,,5,51,0,51,,https://www.reddit.com/r/abarth/comments/w5awkk/cousins_hanging_at_work_abarth_is_mine/,1658497198.0,w5awkk
754,Abarth 595 2016 power cut when accelerating past 5.5-6k RPM,Moist_Cable_4247,"Hi Guys

Im a relatively new owner of an Abarth 595 2016 model and I've come across an issue.

Im not sure it happens everytime because i usually shift at 5k rpm, but when accelerating hard and going past 5-6k I notice the car lurches forwards and completely cuts power despite not reaching redline and having my foot 100% on the gas.

Drives normal until i hit a high RPM.

Has anyone experienced this before or knows what's going on?

Any help is appreciated

Thank you",8,2,0,2,,https://www.reddit.com/r/abarth/comments/w4qhf4/abarth_595_2016_power_cut_when_accelerating_past/,1658434354.0,w4qhf4
755,New to Group 2017 Abarth,,,3,38,0,38,,https://www.reddit.com/r/abarth/comments/w42t85/new_to_group_2017_abarth/,1658364953.0,w42t85
756,Are these stock Abarth wheels?,NsWelsh,"I've had my 595 for a little while and I've been struggling to find any others with the same wheels, so I believe they're aftermarket with Abarth centre caps. There are no markings or brand names unfortunately. 

Does anyone else have these too or know what wheels they may actually be?
https://imgur.com/a/74iMpCi",4,8,0,8,,https://www.reddit.com/r/abarth/comments/w3wbrg/are_these_stock_abarth_wheels/,1658348225.0,w3wbrg
757,Are there any L.A. area Fiat 500 Abarth groups/meetups/canyon runs?,Mean-Type2355,,5,4,0,4,,https://www.reddit.com/r/abarth/comments/w3u0g3/are_there_any_la_area_fiat_500_abarth/,1658342524.0,w3u0g3
758,Oil filter housing for a 2015 Abarth 500 Cabrio PN?,spadefoot,"Does anyone know the part number for the Oil filter housing on a 2015 Abarth 500 Cabrio (US)? I've had one on back order for a couple of months at Mopar parts Online. Doing some looking, I'm not able to assure myself that I have the right part number ordered. I have  4892932AA  on order. Anyone know for sure what the right part for this vehicle is?",7,1,0,1,,https://www.reddit.com/r/abarth/comments/w3lz0d/oil_filter_housing_for_a_2015_abarth_500_cabrio_pn/,1658322636.0,w3lz0d
759,I need some Abarth buddies.,PeetTreedish,"Got my car fixed this morning finally. Decided to take it out for a drive. (For u AZ folks) I live in Tempe proper. Got a flat at 7th st and T-Bird. That was at 10pm. Called roadside ass. After discovering that fix a flat and a broken airhose was gonna do nothing. As I type this, Ive been home 10 minutes. In a city of millions, it took 6 hours to get a tow truck and 4 very irate calls to Progressive to finally get my car to Discount Tire. Charged me $82 for the tow too, even though I already pay for it.",9,4,0,4,,https://www.reddit.com/r/abarth/comments/w3kejr/i_need_some_abarth_buddies/,1658317989.0,w3kejr
760,is Abarth 500 with alcantara interior factory option or modification?,onufmi,"the 500 we all love has one flaw. cheap interior. i saw one online with alcantara dash, A pillars, doors and more online. it was a 2020 esseesse. was that a modification or factory option? seller doesnt mention where its from.",2,2,0,2,,https://www.reddit.com/r/abarth/comments/w3ez0n/is_abarth_500_with_alcantara_interior_factory/,1658297623.0,w3ez0n
761,Worth every penny,Kuby,,14,42,0,42,,https://www.reddit.com/r/abarth/comments/w39oxh/worth_every_penny/,1658281258.0,w39oxh
762,My Nightmare continues,BK2Jers2BK,"You may have seen my earlier post regarding my girl's issues last weekend; she's a 2013 Abarth which I purchased with 22k miles plus an extended warranty sold through the dealership with a company in NJ. Regardless, I made it back to Brooklyn from Lower CT with a knocking sound (increasing in frequency with acceleration) coming from the engine. I dropped the car off yesterday and spoke to my guy today. The noise is coming from the engine so he's going to start the claim through the warranty company. He said It's going to cost me $1k for the engine tear down. And that usually, they will need to replace the engine. Something I cannot afford to do and am hopeful the warranty pays. I mean, this is the exact kind of issue they're supposed to cover. They didn't cover the door handle that stopped working after my kid pulled on it. They didn't cover an issue with the clutch.

Anyway, I'm just venting here. If anyone has any anecdotes or personal experience with this strange issue, please share. My baby girl (I named her Anna Lucia) who I adore is way too young to be having such problems.",6,3,0,3,,https://www.reddit.com/r/abarth/comments/w2d53m/my_nightmare_continues/,1658185848.0,w2d53m
763,Quality pics of my project Alfarth 🍀,Psychological-Pin830,,16,70,0,70,,https://www.reddit.com/r/abarth/comments/w27hbp/quality_pics_of_my_project_alfarth/,1658171434.0,w27hbp
