,title,author,text,numcm,ups,downs,score,likes,link,time,id
0,Roof Box,dildo-reviewer,,1,25,0,25,,https://www.reddit.com/r/abarth/comments/13c4549/roof_box/,1683578540.0,13c4549
1,500 series re-fueling fix,Niff_Naff,"So I started experiencing issues with my 595 Abarth where I'd go to put fuel in and the pump would instantly stop. I could see as I was filling, that bubbles were creeping to the fuel nozzle which causes it to stop pumping. 

A couple of forum posts suggested taking the back bench off and tapping the fuel pump lightly as the rollover valve can get stuck and cause this behaviour. I did this AND IT WORKED! I figured I would share on here because it seems to be a common issue with the 500 series Abarth's and I'm actually astounded it worked! 

Has saved me a trip to the dealer and probably a lot of money too. I'm not too fussed if I have to do it every now and then because it's a 10 minute job with the right tools.",9,12,0,12,,https://www.reddit.com/r/abarth/comments/139ruhg/500_series_refueling_fix/,1683384351.0,139ruhg
2,Golf cart for scale,Logical_115,Needed to do this.,4,41,0,41,,https://www.reddit.com/r/abarth/comments/13960j0/golf_cart_for_scale/,1683331586.0,13960j0
3,Removing monza exhaust question,Wooden_Cat9633,"Hi,

Girlfriend wanted her bombardone put back on instead of the supplied monza ( trofeo 68 plate ) 

The monza has the vaccum type valve, does the pipe need plugging after removal of the exhaust? 

Thanks in advance.",0,2,0,2,,https://www.reddit.com/r/abarth/comments/138n2cd/removing_monza_exhaust_question/,1683295058.0,138n2cd
4,2013 Abarth - 68K Miles - Boost Leak? I Have a 500 Madness ECU Piggyback - Could It Be The Cause Or Something Else? Very Noticeable In 4th and 5th Gear.,HipHopHistoryGuy,,25,2,0,2,,https://www.reddit.com/r/abarth/comments/1381jl4/2013_abarth_68k_miles_boost_leak_i_have_a_500/,1683237817.0,1381jl4
5,Opportunity strikes,MoodyDolphins,"Lol their LP said ""work 4 it ""! Nice",6,46,0,46,,https://www.reddit.com/r/abarth/comments/137tuet/opportunity_strikes/,1683220943.0,137tuet
6,May the 4th Be With You!,Inevitable_Rebel,,10,33,0,33,,https://www.reddit.com/r/abarth/comments/137nkam/may_the_4th_be_with_you/,1683211294.0,137nkam
7,"Shifter was locked up after a prolonged sit, replaced the shift linkage bracket and added some new poly bushings while I was in there. Oh how I've missed driving this car.",NotagoK,,9,22,0,22,,https://www.reddit.com/r/abarth/comments/136jl1w/shifter_was_locked_up_after_a_prolonged_sit/,1683118069.0,136jl1w
8,Any Abarth's around the Milwaukee area?,MoodyDolphins,,5,2,0,2,,https://www.reddit.com/r/abarth/comments/136ftuk/any_abarths_around_the_milwaukee_area/,1683107015.0,136ftuk
9,This photo of my beautiful Abarth looks stock. My boyfriend got a rolling shot of me going through a puddle. (Nikon Zfc),bsalamander,,0,21,0,21,,https://www.reddit.com/r/abarth/comments/136a7bs/this_photo_of_my_beautiful_abarth_looks_stock_my/,1683087809.0,136a7bs
10,I’m jealous of those of you in Europe,bsalamander,"I’ve just got to say- those of you in Europe, I’m envious. I’m in the US and sure electric 500s are coming here in 2024, but I want access to those 595 and 695s. You don’t know how lucky you guys are…",16,5,0,5,,https://www.reddit.com/r/abarth/comments/136a5jj/im_jealous_of_those_of_you_in_europe/,1683087652.0,136a5jj
11,2013 Cabrio,Lolol265,"Picked up a 2013 Cabrio w/ just under 91K miles little over a week ago and I’ve loved it ever since, such a fun daily driver",12,13,0,13,,https://www.reddit.com/r/abarth/comments/1369iv6/2013_cabrio/,1683085672.0,1369iv6
12,My new beauty of a purchase,EwPandaa,Bought myself a 2013 Abarth 500 Manual this weekend. Love her to pieces.,12,54,0,54,,https://www.reddit.com/r/abarth/comments/136301s/my_new_beauty_of_a_purchase/,1683067857.0,136301s
13,Bombardone and Record monza - 595.,yurdaz7,"Hello everyone. I recently bought a 2022 595 Competizione and I disconnected the pin that regulates the exhaust, so as to leave it always open and I must say that it makes a great racket. Some say that the Bombardone at low revs and idle makes a lot more noise, some say it's very similar. What do you think about it? Thank you very much.",4,4,0,4,,https://www.reddit.com/r/abarth/comments/135iwhu/bombardone_and_record_monza_595/,1683028421.0,135iwhu
14,Ready for those hot AZ summers.,Piggy145145,,14,53,0,53,,https://www.reddit.com/r/abarth/comments/1356i7u/ready_for_those_hot_az_summers/,1682988113.0,1356i7u
15,Soft-wall summer tires,irescueducks,"Dearest Scorpioneros,

I'm on the lookout for a fresh set of summer tires with a soft wall. I own a 595 Turismo with 17"" rims and Pirelli PZero Nero 205/40 R17 summer tires. These are made out of devil's cement or some other inadequate compound.They make the ride super rough. On the upside, they never broke grip for me, so i respect them for that.

I'm looking for a softer-wall, civilized tire that is good for all-round driving and makes the ride more pleasing comfort-wise. I don't do track.

What's your pick?",11,3,0,3,,https://www.reddit.com/r/abarth/comments/1350519/softwall_summer_tires/,1682972509.0,1350519
16,I’m thinking of saving and buying a 500 Abarth. Any tips ?,tinom56,"So after years of working for the official dealership in my city I just couldn’t forget the first drive in a 595 Abarth.
I even drove a GIULIA QV a dream car of mine and I loved it. As a Alfa fan tough nothing could compare to the Abarth.
So I was wondering if I could get a first gen ( so to call it a 2008-2012 ) Abarth for around 10-15k ? There some cheaper at around 7-8k but very few. 
Anything to lookout for and are they problematic cars ?
As far as I know the regular fiats that recieved the 1.4 T-jet like the grande Puntos and others had no problems as the engine was quite durable. Now Multi air ones like in the Alfa Romeo MiTos ( closest and cheaper to an Abarth ) had both T-Jets and Multiairs and they were kinda finicky but not a mass of them.
Any tips would be appreciated.",7,10,0,10,,https://www.reddit.com/r/abarth/comments/134xl16/im_thinking_of_saving_and_buying_a_500_abarth_any/,1682966547.0,134xl16
17,Installing rear camera on 2915 Abarth.,Patient-Buy-9864,Has anyone done this without having to run the wire through the rubber trunk grommet? Thx.,13,5,0,5,,https://www.reddit.com/r/abarth/comments/134wuj8/installing_rear_camera_on_2915_abarth/,1682964822.0,134wuj8
18,Best Source(s) for Body Panels,JohnathanGower,"I'm wanting to replace the front bumper (cracked), back bumper (peeling) and wing (cracked)...what's the best source for these either OEM or aftermarket?  Mine is a U. S. spec 2013 Fiat 500 Abarth in Grey.  Thanks in advance for everyone's help!",4,2,0,2,,https://www.reddit.com/r/abarth/comments/133go27/best_sources_for_body_panels/,1682832311.0,133go27
19,Proper LED Fog lights for Abarths (bolt on),jkbenn02,"TLDR: FCA part number 68228884AD uses the same brackets as Abarths. 

Warning…I’m used to long forum posts so forgive the rambling. Also another warning, the fogs aren’t installed yet. 

After successfully installing NHK Gen V bi-led headlight projector assemblies in my 2013 Abarth I wanted to complete the lighting package with proper LED fog lights. I had tried just bulbs (in the headlights) but I knew it wouldn’t provide good lighting and while also knowing that it would likely make me a menace to society riding around with light going everywhere.  At least I could confirm personally that they sucked. And they did.  

I say proper because far too many people are just swapping bulbs which just isn’t right. Shitty beam patterns…regardless of how much they claim that “my $50 led bulbs are great”. 🙄trust me..they aren’t great. They may be brighter than halogens but the pattern is horrible even if you clock the bulbs in every direction. 

Anyways, I split the headlights via baking and installed the LED projectors in place of the original halogens using various adapters. It was a lot of work and well worth the effort. Now the  headlights are just amazing and on par with my Tesla 3 which are extremely good. I used aftermarket Depo headlights as I didn’t want to deal with the OE permaseal. It was still a painful process (hot headlights are no fun to open). At least this way I could take my time as the car still had the headlights in place. 

On to the main topic, the fog lights:

SURELY I’m not the first person to notice this but I haven’t seen anyone else post this before. These cars have been out for over a decade and the community is pretty damn good especially when it comes to modding them. 

Anyways, I wanted to share this with you all. Despite all those out there claiming no replacements exist I believe I can prove otherwise. 

I think we can all agree that the Abarth fog assemblies have a distinctive look to them when removed. So off to eBay I went. A quick cross reference of the oe part number showed a number of the other FCA cars that used the same assembly. This gave me hope 🤣

Then I backed out that part number from my search and just put “LED Fog dodge” (or other brand such as Jeep) and you will quickly see factory LED fog lights that look almost identical to the Abarth fog lights. I could have stopped there and thrown those into my bumper but I wanted something better.  So if you want LED bolt in fog lights just stop here. For around ~$60 you can’t beat them.

I bought a cheap set of LED fog lights on eBay (part number 68228884AD) to compare to the Abarth’s fogs. I couldn’t tell a difference between the Abarth and Jeep brackets so I took the next step of getting Morimoto XB fog lights (part number LF620). These are marketed for all those other FCA models previously mentioned but no 500 Abarth at all but it only took me a few small leaps to make the “connection”)

If going the aftermarket OE route, just install them as delivered. I can’t comment on the wiring for those but the plug looks the same between the OE abarth H11 plug and the aftermarket OE style led. 

I’ll be installing the Morimotos soon so I’ll update this if there are any issues. Even if some type of resistor is needed that is still not a big deal. 

NOTE: The reflector on the aftermarket OE style are going to be about 3/8” shorter compared to the original fog lights BUT the chrome trim rings appear to be the same depth so there shouldn’t be a larger gap or anything like that. 

Perhaps I’m missing something mounting-wise and nobody is talking about it but I think this is a good solution for inexpensively upgrading your fogs to LEDs for about the same price as doing it the wrong way (just installing led bulbs into your halogen housings)

For some reason I can’t post links and pictures so send me a message if you’d like the pics or links.  I’ll also try to post them as a reply.",5,7,0,7,,https://www.reddit.com/r/abarth/comments/1335l64/proper_led_fog_lights_for_abarths_bolt_on/,1682799462.0,1335l64
20,Remove Tunes from EC Tablet Tuner,Fantastic-Company-34,Can anyone assist ? How to I remove specific uploaded tunes from the EC Tablet Tuner,1,0,0,0,,https://www.reddit.com/r/abarth/comments/131rer5/remove_tunes_from_ec_tablet_tuner/,1682687663.0,131rer5
21,Swapping monzo for bombardone.,Wooden_Cat9633,"Hi,

Girlfriend had a 2016 145 abarth with a bombardone.

Picked up her 2019 adrenaline green trofeo yesterday and it comes with the monza exhaust, she wants her bombardone put back on, is it just a case of unplugging the electrical connector & tieing it up? 

Thanks in advance 😁",1,3,0,3,,https://www.reddit.com/r/abarth/comments/131nj33/swapping_monzo_for_bombardone/,1682676877.0,131nj33
22,Koni experience,abarth_23,"I have a NA fiat 500 Abarth with approximately 45,000 miles. Changed out the stock struts front and rear to koni yellows Front and special active rear along with lowering springs and damn these improved everything on the comfort and handling monumentally. The confidence taking the 110 freeway here on Los Angeles now is like a Disney ride with no wait times in line for a thrilling experience. Pot holes and imperfect pavement discomfort is severely reduced as well. Makes local errands like a pleasure trip.  I realize this isn't the ultimate suspension set-up, but for the dollars per smile it costs and gives it's a fantastic option for keeping budget friendly and making the car totally enjoyable. This is my 10th day with the set-up so I'll post a long term review in 6 months.",8,11,0,11,,https://www.reddit.com/r/abarth/comments/131eabc/koni_experience/,1682646727.0,131eabc
23,"Well deserved bath, ready for the weekend!",Tadashix,,3,49,0,49,,https://www.reddit.com/r/abarth/comments/131d3qp/well_deserved_bath_ready_for_the_weekend/,1682643495.0,131d3qp
24,Fuel Indicator Error,ShiroEd,My digital fuel guage indicator on my 2017 595 Comp has just today started going all the way right to FULL and stays there. Anyone experienced this or know what might be going on?,2,2,0,2,,https://www.reddit.com/r/abarth/comments/1312azb/fuel_indicator_error/,1682621846.0,1312azb
25,Temporary rough draft,MoodyDolphins,,0,12,0,12,,https://www.reddit.com/r/abarth/comments/1311i8i/temporary_rough_draft/,1682620427.0,1311i8i
26,Abarth punto evo parts,rolex-23,Where is the best place in the UK for Abarth punto evo modification etc?,1,0,0,0,,https://www.reddit.com/r/abarth/comments/130ufuf/abarth_punto_evo_parts/,1682612956.0,130ufuf
27,Ready summer! ☀️🐞,DeeODoubIeG,,8,83,0,83,,https://www.reddit.com/r/abarth/comments/130nvrh/ready_summer/,1682605693.0,130nvrh
28,I have never been to track day before. How should i prepare?,onufmi,I have 2015 abarth 500 and i would like to go to some smaller european track,2,3,0,3,,https://www.reddit.com/r/abarth/comments/130bd8k/i_have_never_been_to_track_day_before_how_should/,1682574604.0,130bd8k
29,My Fiat 500 GQ,Rodmixx,,6,22,0,22,,https://www.reddit.com/r/abarth/comments/1302qz7/my_fiat_500_gq/,1682550521.0,1302qz7
30,"16k with 15,000 miles. Decent buy?",Late_Pop_7827,,44,85,0,85,,https://www.reddit.com/r/abarth/comments/12zqb2h/16k_with_15000_miles_decent_buy/,1682528371.0,12zqb2h
31,My 🐝,ilikeskullsandbones,,6,73,0,73,,https://www.reddit.com/r/abarth/comments/12zoizc/my/,1682526156.0,12zoizc
32,Punto evo spoiler,rolex-23,Do i make this from my spoiler or do i buy it an an add on piece?,3,8,0,8,,https://www.reddit.com/r/abarth/comments/12ypuob/punto_evo_spoiler/,1682443283.0,12ypuob
33,Will a new engine and new clutch increase sale value?,WafflesJCorgington,"I have a 2013 Abarth 500 in gray. Bought it new in 2014 with 7 miles on the odometer. California owned the whole time and it’s all stock. Recently hit 100,000 miles and the engine died on me at around 100,900. Got a new engine in there and a new clutch. If I wanted to sell it in the future, would it fetch a little more than I high mileage car would? The chassis would have over 100,000 miles but she’s got a new heart. Lol. What say you, lads and lassies?",14,1,0,1,,https://www.reddit.com/r/abarth/comments/12y9dln/will_a_new_engine_and_new_clutch_increase_sale/,1682400602.0,12y9dln
34,Selling my Abarth,Bootato,"Hey y'all, I'm in the US (Seattle, WA) and looking to sell my Abarth. I'm getting a lot of mixed messages about the value of the car/market rate, and I haven't sold a car in about 15 years. I'm curious to know if you have any suggestions on how to go about this.

I have a white 2013, mostly stock with the cravenspeed short shift and bracket. 84,000 miles. Very good condition (the red seat loops and hatch pull are intact lol)

Dealers are selling them for between $12-18k in my area, but some people on facebook marketplace are selling them for about half that (albeit with much higher mileage) I listed mine for 14k, thinking that might be a bit high. I've only had one bite so far. Carvana only offered me about $7.5k but they're selling them for double that.

Where else do people buy cars from private sellers these days? Is my price delusional? I paid \~15k two years ago and babied the hell out of it in the mean time.

Thanks in advance!",8,1,0,1,,https://www.reddit.com/r/abarth/comments/12y0kda/selling_my_abarth/,1682378873.0,12y0kda
35,Just not my time...,twohoundtown,"Today I decided I was going to buy the 2016 that's been sitting on the lot almost 2 months. My finances just changed so I could afford it and I was pre-approved! I drive down there, I don't see it... I ask my sales guy, someone bought it Friday! /sigh",7,8,0,8,,https://www.reddit.com/r/abarth/comments/12xqajb/just_not_my_time/,1682357991.0,12xqajb
36,Just ordered my first Abarth ❤️,TheCapo5,"Arriving in early july. My2023 version 595 165hp. Debating if upgrade to record monza exhaust right away, let me know if it’s worth or not and other cool small upgrades <3",19,86,0,86,,https://www.reddit.com/r/abarth/comments/12xkxhd/just_ordered_my_first_abarth/,1682349816.0,12xkxhd
37,SL1 LED Bulbs by Diode Dynamics Installation Woes,MarcosaurusRex,"Have had these bad boys for about a year, but each time I try installing them, it’s frustrating to get them seated proper, and they always seem to come at an angle. Was wondering if anyone has had similar issues with this bulb or anything akin to them. Or even some advice on how to get these shooting straight. 

They look amazing and a huge step up from my old bulbs. But they’re so cross eyed that my old bulbs work even better at lighting up the road.",1,1,0,1,,https://www.reddit.com/r/abarth/comments/12x2xbg/sl1_led_bulbs_by_diode_dynamics_installation_woes/,1682310136.0,12x2xbg
38,Some small mods on my little bullet,Sharp-Value-9309,,11,58,0,58,,https://www.reddit.com/r/abarth/comments/12wktzr/some_small_mods_on_my_little_bullet/,1682274008.0,12wktzr
39,Question about Cobra Auto Accessories full front end mask for the 500 Abarth,,"I purchased one of their bonnet covers (one piece, covers several inches of the hood only) and it was easy enough to figure out how to install.

I just got their one-piece full front end cover (not like the bras I am used to that are two piece.)

There are no instructions included and I can’t find any on their website.  For the life of me, I can’t figure out how to install it and where the straps all go.

Anyone have any experience with these?",3,1,0,1,,https://www.reddit.com/r/abarth/comments/12wdypv/question_about_cobra_auto_accessories_full_front/,1682263111.0,12wdypv
40,Gave my 126 a Abarth racing livery,ClutchkickRobcio,https://youtu.be/FAM7Mumf6sk,0,5,0,5,,https://www.reddit.com/r/abarth/comments/12wbuyw/gave_my_126_a_abarth_racing_livery/,1682261195.0,12wbuyw
41,Incorrect vin information?,twohoundtown,"I've been searching abarths and sports, I've noticed some of the vins I search everything seems accurate except it will say automatic transmission when in the photos it's clearly a stick. Is this an issue or are they scamming?",2,1,0,1,,https://www.reddit.com/r/abarth/comments/12war7i/incorrect_vin_information/,1682260177.0,12war7i
42,Sound on,Dev-A-B,New exhaust ,8,16,0,16,,https://www.reddit.com/r/abarth/comments/12w96ir/sound_on/,1682257479.0,12w96ir
43,"Washed the car today and noticed it has some rough parts on the paintwork. Read it could be due to contamination, what's the best way to fix this and get it back to a smooth/glossy finish?",lukeewatson,,10,2,0,2,,https://www.reddit.com/r/abarth/comments/12vltvm/washed_the_car_today_and_noticed_it_has_some/,1682202552.0,12vltvm
44,"I'm selling my '17 124 Abarth! 6-speed, Recaro Seats, Fully-loaded, 20K miles",awestons,"&#x200B;

https://preview.redd.it/khi9ewyddiva1.jpg?width=4080&format=pjpg&auto=webp&v=enabled&s=06d6a34e3b44bc8d719b429aaa37636c8d02da38

https://preview.redd.it/1c81kyyddiva1.jpg?width=4080&format=pjpg&auto=webp&v=enabled&s=fa570908b61dc275295c89f76abbca21a76db4b5

https://preview.redd.it/fmue50zddiva1.jpg?width=4080&format=pjpg&auto=webp&v=enabled&s=c3257207eed1e5d07672cd8f462e7856a1423c41",2,5,0,5,,https://www.reddit.com/r/abarth/comments/12vl12l/im_selling_my_17_124_abarth_6speed_recaro_seats/,1682200928.0,12vl12l
45,Looking to improve security,Reddittats,"Had my Abarth 595 now for around 8 months, as we know Abarth don’t have great security and recently they have been going missing around my area like crazy as of recent - so looking for something like an immobiliser/ alarm system or tracker - any suggestions on brand and where to get them from, thanks!",10,3,0,3,,https://www.reddit.com/r/abarth/comments/12v5owm/looking_to_improve_security/,1682169499.0,12v5owm
46,New exhaust,Dev-A-B,,7,18,0,18,,https://www.reddit.com/r/abarth/comments/12v3pi0/new_exhaust/,1682164402.0,12v3pi0
47,13k for 2015 w/ 60k miles,dapperdad15,I recently bought an abarth for 13k and even tho I love the car I worry if I spent too much on it for the amount of miles currently on it. I do plan on renting it out on Turo to hopefully pay it off quickly. Is 13k too much for it? 😅 when do the transmissions typically go out on them?,16,14,0,14,,https://www.reddit.com/r/abarth/comments/12uuari/13k_for_2015_w_60k_miles/,1682136998.0,12uuari
48,Madness max power,Salt-GoblinXIII,"Looking for anyone who as actual experience with the product, how it works, does it even make a real difference?",2,0,0,0,,https://www.reddit.com/r/abarth/comments/12uswf4/madness_max_power/,1682133475.0,12uswf4
49,Getting warm and sunny in Socal. So I bought one.,PatientWho,,12,111,0,111,,https://www.reddit.com/r/abarth/comments/12up3yh/getting_warm_and_sunny_in_socal_so_i_bought_one/,1682124893.0,12up3yh
50,2011 Fiat 500 Abarth 94k miles. How many miles you guys clocking?,Pale_Percentage9443,"Considering purchasing one of these, fair price. Car has been looked after, no known issues.

Just wondering what sort of mileage are you guys clocking up on these little beauties?",36,8,0,8,,https://www.reddit.com/r/abarth/comments/12tvtht/2011_fiat_500_abarth_94k_miles_how_many_miles_you/,1682068491.0,12tvtht
51,Vibration under acceleration.,ic2drop,"So I have picked up a 2010 500 Abarth with roughly 96k kilometers on the dial.  I’ve been replacing parts that the previous owner didn’t bother to keep up with (replaced original shocks, tires, control arms, and new brakes all around). 

When accelerating with any real intent, there is a vibration in the wheel.  Is this normal for these cars or is there something else that should be replaced?  The mechanic I’ve been going to didn’t identify anything, son curious if this is just now they fee under acceleration?",12,8,0,8,,https://www.reddit.com/r/abarth/comments/12sbo13/vibration_under_acceleration/,1681941387.0,12sbo13
52,Is there a model that meets this criteria?,Different-Lie-6609,"Ok so I’m thinking of picking up a 595/695 as a bit of fun but I’m a bit lost with the sheer amount of special editions.

So what I want it have really are the following.

180ps
Body kit (as on the 70th aniversario)
LSD

Interior wise which models avoid having the 500 logo (the big one on passenger side of the dash) as it looks a bit naff.

I’m in the U.K. so models from there.

Thanks.",15,2,0,2,,https://www.reddit.com/r/abarth/comments/12rppnj/is_there_a_model_that_meets_this_criteria/,1681902934.0,12rppnj
53,2021 Essesse cold start petrol smell,tastybagels_1,"Hello all,

I have a 2021 595 Essesse UK spec for about 2 weeks now so I'm quite unfamiliar with these little fire crackers still. Is it normal for these cars to have a petrol smell during cold start? The smell is outside the vehicle and doesn't come into the cabin at all unless I have the windows down. I've had hot hatches before like Type Rs and GR Yaris but none of them have a smell when started cold so am wondering if this is an Abarth quirk. Car is running standard 180hp with the standard Akrapovic exhaust.

Doesn't happen when car is pushed or warm.

Thanks",3,2,0,2,,https://www.reddit.com/r/abarth/comments/12q0a3m/2021_essesse_cold_start_petrol_smell/,1681771817.0,12q0a3m
54,500 Abarth,kyalthered,"Looking at getting a 500 Abarth. One is a 2013 with 58k miles and the other is a 2016 with 24k miles. Both are in the budget but wouldn’t mind saving a little if they aren’t that different. 
Is it worth getting the 2016 over the 2013 aside from age? Looking to just have it as a fun daily driver. Maybe (probably) (okay very likely) some autoX every now and again. 

Side note I’m 6ft7. Are they the same as far as driver space?",28,11,0,11,,https://www.reddit.com/r/abarth/comments/12pslkd/500_abarth/,1681757510.0,12pslkd
55,Question about my Abarth’s color,Ultradog2020,"I’m obsessed with my Abarth but I love it specially because it’s black and yellow. All other Abarths here in my country are either black with red details or red with black details. Also mine has many parts in carbon fibre, the previous owner said both the carbon fibre and the yellow decals were factory options but I’m not so sure. Can yellow decals and carbon fibre parts be a factory option?

Pic of my baby attached",8,24,0,24,,https://www.reddit.com/r/abarth/comments/12niiya/question_about_my_abarths_color/,1681592512.0,12niiya
56,Brakes on 2017 Abarth 595 turismo,iced_astronaut,"Hi, I am just wondering what brake discs and pads does the 2017 turismo come  with. And are there any better alternatives to the stock brake discs and pads around the same price. I live in the UK, idk if it's the same all over the world.",3,1,0,1,,https://www.reddit.com/r/abarth/comments/12mm2nr/brakes_on_2017_abarth_595_turismo/,1681524159.0,12mm2nr
