,title,author,text,numcm,ups,downs,score,likes,link,time,id
475,Still love the satin paint on her,vederan,,3,42,0,42,,https://www.reddit.com/r/abarth/comments/y5peg8/still_love_the_satin_paint_on_her/,1665948218.0,y5peg8
476,Nice photo I grabbed of my GF's 595 before setting off for a convoy,ElicitCS,,4,46,0,46,,https://www.reddit.com/r/abarth/comments/y5d4ut/nice_photo_i_grabbed_of_my_gfs_595_before_setting/,1665914850.0,y5d4ut
477,"This is why “the cuts aren’t straight” I just followed the trim, it’s a track car, not a daily. I drive it once a week.",Zadddyyyyyy,,9,28,0,28,,https://www.reddit.com/r/abarth/comments/y4zcx1/this_is_why_the_cuts_arent_straight_i_just/,1665869833.0,y4zcx1
478,Cant actually figure out a clear answer?,PeetTreedish,It rained this morning. Got in my NA 2013 . TPMS light was on. Also the little Yellow Triangle with the exclamation inside. Put air in the tires. TPMS light is out. Yellow triangle is on still. Internet says several things.,27,5,0,5,,https://www.reddit.com/r/abarth/comments/y4w626/cant_actually_figure_out_a_clear_answer/,1665861430.0,y4w626
479,"Something, something Abarth and sunset…",vanrayhodginski,,4,61,0,61,,https://www.reddit.com/r/abarth/comments/y4hl4j/something_something_abarth_and_sunset/,1665819258.0,y4hl4j
480,Vented my hood,Zadddyyyyyy,,26,32,0,32,,https://www.reddit.com/r/abarth/comments/y48haz/vented_my_hood/,1665789890.0,y48haz
481,Is this a good buy?,jaws74,,30,14,0,14,,https://www.reddit.com/r/abarth/comments/y37o38/is_this_a_good_buy/,1665689586.0,y37o38
482,"Looking at a 500 Abarth from the mid to late 2010's, what should I look out for/ How reliable are they?",,"Note, I'll be at college so I won't have a lot of time to work on my car, even though I know how to do general maintenance.",10,6,0,6,,https://www.reddit.com/r/abarth/comments/y2qh89/looking_at_a_500_abarth_from_the_mid_to_late/,1665639303.0,y2qh89
483,Does anyone know what kind of exhaust pipes this beauty got?,Helpful_Bell_1023,,10,15,0,15,,https://www.reddit.com/r/abarth/comments/y2e8rc/does_anyone_know_what_kind_of_exhaust_pipes_this/,1665605796.0,y2e8rc
484,You guys remember that Abarth 500 I was looking at? I scan the codes and made a list parts I found on it. Still negotiating with them.,Furnahdough,,21,19,0,19,,https://www.reddit.com/r/abarth/comments/y29414/you_guys_remember_that_abarth_500_i_was_looking/,1665593616.0,y29414
485,Anyone have this happen?,ABadPerson13,,17,10,0,10,,https://www.reddit.com/r/abarth/comments/y1kv3i/anyone_have_this_happen/,1665523425.0,y1kv3i
486,Just arrived!!,BK2Jers2BK,She's been off the road since July. Only took 5 or 6 weeks for the brand new engine to arrive. They still need some additional parts but I'm hoping by next week some time. Finally some good news![New Abarth engine](https://imgur.com/gallery/M6nEab6),5,6,0,6,,https://www.reddit.com/r/abarth/comments/y1aj8n/just_arrived/,1665498622.0,y1aj8n
487,Any 595 daily drivers?,WillTradeForFood,"I currently own a Golf GTD and as good as it is, I'm a little bored of it. I love the look of the 595s but just had a few questions. 
How have people found dailying their 595s? Has anyone had any issues with build quality? Is the driving position really as bad as people make out?
Also, is there anything I should look out for when buying? I'm looking at the 180 Comp. 
Thanks!",23,10,0,10,,https://www.reddit.com/r/abarth/comments/y14jtq/any_595_daily_drivers/,1665480658.0,y14jtq
488,Joined the club while I wait for my new EV (delayed due to parts issues) - your thoughts?,SpookyBoogy666,,27,37,0,37,,https://www.reddit.com/r/abarth/comments/y0s6ke/joined_the_club_while_i_wait_for_my_new_ev/,1665441219.0,y0s6ke
489,"Drove my rental on Sustenpass, was absolutely brilliant!",DaAdobo,,13,53,0,53,,https://www.reddit.com/r/abarth/comments/y0r7p7/drove_my_rental_on_sustenpass_was_absolutely/,1665438747.0,y0r7p7
490,Standard Engine Cover Question,seyahremmus,,5,0,0,0,,https://www.reddit.com/r/abarth/comments/y09i9r/standard_engine_cover_question/,1665391142.0,y09i9r
491,Hot Italian bare frontal!,spadefoot,Whichever engineer that was responsible for having to drop the transmission to be able to remove the oil pan should be shot.,14,13,0,13,,https://www.reddit.com/r/abarth/comments/y02i9u/hot_italian_bare_frontal/,1665367011.0,y02i9u
492,Amongst good company in Merritt Island today.,AVroman00,,4,26,0,26,,https://www.reddit.com/r/abarth/comments/xzz9xv/amongst_good_company_in_merritt_island_today/,1665357416.0,xzz9xv
493,Abarth in the mountains🥵,Suzlapulfo,,7,75,0,75,,https://www.reddit.com/r/abarth/comments/xzxtu1/abarth_in_the_mountains/,1665353434.0,xzxtu1
494,"2012 500 Abarth, sounded like it was running on 3 cylinders changed ignition coils and spark plugs and came across a very corroded hole. Any idea what may have caused the corrosion? The 3 other cylinders looked totally fine and not corroded.",DriftCowboy,,11,7,0,7,,https://www.reddit.com/r/abarth/comments/xzv6mn/2012_500_abarth_sounded_like_it_was_running_on_3/,1665346667.0,xzv6mn
495,124 Spider - Alfa 4C Coilpack Installation FTW,kryxldifc,"After experiencing missfires above +3.5k RPM during hard accelararion I bought a while ago a set of Bosch coils intended for the Alfa 4C reading & seeing it being a common swap.

I had one od the spark plugs fail earlier, which a shop that I ended up with swapped for a BRISK, but not the whole set (no shop around had them in store).

So I also switched the whole set of plugs out for some standard Bosch ones (can't get the recommended NKG, seem to be only OEM here in Czechia).

 Seems to have solved the issue, so highly recommended to anyone pushing more than 180bhp on their 1.4 multiair. 

Pic for reference on the border river between Bosnia Herzegovina & Montenegro.",5,22,0,22,,https://www.reddit.com/r/abarth/comments/xzovzq/124_spider_alfa_4c_coilpack_installation_ftw/,1665330639.0,xzovzq
496,(JOKE POST) my Abarth Giulietta,LadyinRedSXT2016,,4,16,0,16,,https://www.reddit.com/r/abarth/comments/xzcyyr/joke_post_my_abarth_giulietta/,1665291475.0,xzcyyr
497,This is first start up of the vehicle from the previous post.,Furnahdough,,11,9,0,9,,https://www.reddit.com/r/abarth/comments/xz8iwx/this_is_first_start_up_of_the_vehicle_from_the/,1665277070.0,xz8iwx
498,What do you guys think this is a good deal or should I negotiate a little more ?,Furnahdough,,60,12,0,12,,https://www.reddit.com/r/abarth/comments/xz441s/what_do_you_guys_think_this_is_a_good_deal_or/,1665264467.0,xz441s
499,Digital lcd instrument cluster,Zeroink16,,2,8,0,8,,https://www.reddit.com/r/abarth/comments/xz393c/digital_lcd_instrument_cluster/,1665262184.0,xz393c
500,Fiat 500 Abarth FFO 2022 MSR Houston,hardankles,,3,6,0,6,,https://www.reddit.com/r/abarth/comments/xyhqgx/fiat_500_abarth_ffo_2022_msr_houston/,1665198202.0,xyhqgx
501,Having some fun,JKitchen91,Getting home from work in my 2013.,2,9,0,9,,https://www.reddit.com/r/abarth/comments/xye0h1/having_some_fun/,1665186867.0,xye0h1
502,after 37 days in the shop. We're reunited and it feels so good.,TheDave78,,18,60,0,60,,https://www.reddit.com/r/abarth/comments/xycljg/after_37_days_in_the_shop_were_reunited_and_it/,1665182930.0,xycljg
503,Stilo Abarth Cluster,rick_alvim,,2,12,0,12,,https://www.reddit.com/r/abarth/comments/xya4rf/stilo_abarth_cluster/,1665176472.0,xya4rf
504,Got an oil change today. They said there is a small leak in the engines main seal and a torn cv boot. Can just the cv boot be replaced? Whats it take to fix a main seal? Rebuild the engine?,PeetTreedish,,6,0,0,0,,https://www.reddit.com/r/abarth/comments/xy9znn/got_an_oil_change_today_they_said_there_is_a/,1665176127.0,xy9znn
505,Finally feeling like fall!,jessiekgage,,0,36,0,36,,https://www.reddit.com/r/abarth/comments/xy9kc1/finally_feeling_like_fall/,1665175048.0,xy9kc1
506,My Daily Driver 🦂,thejetmeister19,,4,45,0,45,,https://www.reddit.com/r/abarth/comments/xy52qs/my_daily_driver/,1665163853.0,xy52qs
507,Officially joined the club,seyahremmus,,10,66,0,66,,https://www.reddit.com/r/abarth/comments/xy4wvm/officially_joined_the_club/,1665163459.0,xy4wvm
508,Meet my 595 here freshly wrapped. Getting new rims today!,mkuijper298,,14,54,0,54,,https://www.reddit.com/r/abarth/comments/xxrbiu/meet_my_595_here_freshly_wrapped_getting_new_rims/,1665122685.0,xxrbiu
509,ETC Light Flashing,thewdit,"2013 Fiat Abarth NA about 89000km on the way home on a 16’c afternoon.

Car started fine, but started to suddenly feel sluggish then the ETC light popped up and kept flashing along with a solid engine light.

Drove home and switched the engine off, and restarted car; engine light still solid, but ETC light not on anymore.

Oil is not supposed to be changed until 92000km but sometimes when i pull a sharper turn, car would beep and mention something like low oil pressure. 

Anyone else experienced this and know what may be the cause? I googled a little and someone had mention it could be the battery, though i cant check until i get to work again tomorrow and get a multimeter to check that out.",9,2,0,2,,https://www.reddit.com/r/abarth/comments/xxpntt/etc_light_flashing/,1665117192.0,xxpntt
510,Meet Pokérari,LCWrig922,,7,12,0,12,,https://www.reddit.com/r/abarth/comments/xxk2nh/meet_pokérari/,1665100376.0,xxk2nh
511,"I’d like to introduce a new member to the community, Abby, my 2013 Abarth",SpiccyDropMag,,4,39,0,39,,https://www.reddit.com/r/abarth/comments/xxikxd/id_like_to_introduce_a_new_member_to_the/,1665096180.0,xxikxd
512,My Ravioli Roadster. New to me 2012 Abarth.,Ninja_guy17,,12,39,0,39,,https://www.reddit.com/r/abarth/comments/xxf3du/my_ravioli_roadster_new_to_me_2012_abarth/,1665087349.0,xxf3du
513,Hey guys just got my new (to me) 2012 Abarth. I was thinking of adding a rear spoiler. Any advice?,Ninja_guy17,"I have a Nero with red accents. Also I got a great deal, somehow the thing only had 68k.

Edit: Fiat 500 Abarth",13,6,0,6,,https://www.reddit.com/r/abarth/comments/xxb5k5/hey_guys_just_got_my_new_to_me_2012_abarth_i_was/,1665077701.0,xxb5k5
514,prep tjme to paint a fibreglass hood?,carmod113,"looking at a few shops to paint an aftermarket fibreglass hood for my abarth 595, one shop said it'd take an hour and a half but another said it could take 6? the first shop said it'd get baked in the drying process but the second shop mentioned pre-baking and potential pinholes. which one is most realistic? i want it done right",1,1,0,1,,https://www.reddit.com/r/abarth/comments/xx89sw/prep_tjme_to_paint_a_fibreglass_hood/,1665070642.0,xx89sw
515,Abarth on 45k miles making noise in 1st gear and reverse,LeHiko,,10,9,0,9,,https://www.reddit.com/r/abarth/comments/xx5e0o/abarth_on_45k_miles_making_noise_in_1st_gear_and/,1665063181.0,xx5e0o
516,Air/Oil Separator Service,Moist_Cable_4247,"Hi Guys 

I've recently cleaned the Air/Oil separator of all the built up gunk and oil after 20k Miles, and I was wondering if anyone's done it themselves before?

I couldn't find any YouTube Vidoes on how to do this on the Euro spec cars, as all the videos were on the American spec Abarths, and their separator looks a bit different.

Nonetheless, I gave it a go (super easy) and cleaned a lot of gunk and oil out.

It appears the separator has a couple of seals which allow/prevent air coming in and out a certain way. I can't imagine they worked very well with all the build-up inside.

Once cleaned with brake cleaner, they open/closed as they should perfectly every time.

There are 3 openings to the separator (don't bother trying to unscre the cap on top) which I sprayed brake cleaner into, until the cleaner run clear. 

I also replaced the O-Ring on the separator where it connects to the top of the engine.

If you guys give this a try yourselves, let me know what treasures you find inside 🤮

I've also heard that the Air/Oil separator can be linked to high engine oil consumption, but we'll see.",2,8,0,8,,https://www.reddit.com/r/abarth/comments/xx1t9f/airoil_separator_service/,1665051848.0,xx1t9f
517,Podium Blue Just Hits Different,Moist_Cable_4247,,4,25,0,25,,https://www.reddit.com/r/abarth/comments/xwo3d2/podium_blue_just_hits_different/,1665008158.0,xwo3d2
518,A Clean 🎃,jessiekgage,,2,44,0,44,,https://www.reddit.com/r/abarth/comments/xwhstf/a_clean/,1664993263.0,xwhstf
519,DRL,No-Day9810,"Question,

if i do this to the DRL, would i be able to eliminate the DRL warning on the infoscreen, also my turn signals are located with the DRL connector
I have a north american Abarth

Pic taken from ig: @victor_500abarth",5,50,0,50,,https://www.reddit.com/r/abarth/comments/xwgp7e/drl/,1664990727.0,xwgp7e
520,"142mph STOCK… what are you guys seeing your 595’s top out at? (Autobahn, pls don’t sue me)",AtomicFrisbeee,,28,7,0,7,,https://www.reddit.com/r/abarth/comments/xvtb10/142mph_stock_what_are_you_guys_seeing_your_595s/,1664924023.0,xvtb10
521,Our favorite month🎃😆,jessiekgage,,3,46,0,46,,https://www.reddit.com/r/abarth/comments/xvnej3/our_favorite_month/,1664909785.0,xvnej3
522,Anyone know the ET for these?,mashedtaytos,,6,9,0,9,,https://www.reddit.com/r/abarth/comments/xvjkag/anyone_know_the_et_for_these/,1664900863.0,xvjkag
523,Also selling these. Colorado Springs 600 obo,LCWrig922,,0,5,0,5,,https://www.reddit.com/r/abarth/comments/xuy7sk/also_selling_these_colorado_springs_600_obo/,1664837975.0,xuy7sk
524,"Abarth 595, 200horsepower, weights just 950kg, cold air intake, straight-piped exhaust, larger turbo, coil-overs, elected cabin, maxton design trim",MTSGRG,,7,39,0,39,,https://www.reddit.com/r/abarth/comments/xuvi9x/abarth_595_200horsepower_weights_just_950kg_cold/,1664831249.0,xuvi9x
525,Anyone want these rims? $600 obo,LCWrig922,,3,3,0,3,,https://www.reddit.com/r/abarth/comments/xu67fu/anyone_want_these_rims_600_obo/,1664761872.0,xu67fu
526,Enjoying Fiat Freakout 2022,Intelligent-Mine9778,,13,44,0,44,,https://www.reddit.com/r/abarth/comments/xtdich/enjoying_fiat_freakout_2022/,1664678947.0,xtdich
527,No crank no start: electronics are fine,MTBERTURNEDROADIE,"I can turn the key one click and it’s like normal: fuel pump turns on and everything inside works. Then I go second click and there’s no cranking, no clicking, nothing. 

It usually starts if I wait 30 minutes or so. It’s a 2012 500 abarth 5 speed manual. I’ve seen some stuff online that makes me think it’s a fuse relay. 

Thanks!",6,3,0,3,,https://www.reddit.com/r/abarth/comments/xrl4gq/no_crank_no_start_electronics_are_fine/,1664491028.0,xrl4gq
528,NA to EU Taillight for LED 5-Pin to 4-Pin,4jellis,,5,13,0,13,,https://www.reddit.com/r/abarth/comments/xray99/na_to_eu_taillight_for_led_5pin_to_4pin/,1664465781.0,xray99
529,Any ideas what this is?,LeadReverend,,19,8,0,8,,https://www.reddit.com/r/abarth/comments/xqpkbi/any_ideas_what_this_is/,1664401915.0,xqpkbi
530,Abarths for Sale?,Ok-Satisfaction5974,"Hello, Anybody have an abarth for sale in tri state area?
Please send over options
Must have premium sound & heated seats
Thanks",10,3,0,3,,https://www.reddit.com/r/abarth/comments/xqp21v/abarths_for_sale/,1664400689.0,xqp21v
531,"Aaaand I'm done! Not perfect, but won't look any better :D (800+ beads)",Moist_Cable_4247,,3,46,0,46,,https://www.reddit.com/r/abarth/comments/xqcrwg/aaaand_im_done_not_perfect_but_wont_look_any/,1664371723.0,xqcrwg
532,Anyone else own the Abarth Punto Evo?,TheYeeYeeOne,,10,25,0,25,,https://www.reddit.com/r/abarth/comments/xphew6/anyone_else_own_the_abarth_punto_evo/,1664286805.0,xphew6
533,Got a few OEM parts from Italy,4jellis,,25,47,0,47,,https://www.reddit.com/r/abarth/comments/xph92m/got_a_few_oem_parts_from_italy/,1664286416.0,xph92m
534,It’s been too long!,AbarthLover,,1,22,0,22,,https://www.reddit.com/r/abarth/comments/xp6m1p/its_been_too_long/,1664253455.0,xp6m1p
535,Pocket rocket,alexb92,,5,41,0,41,,https://www.reddit.com/r/abarth/comments/xp2s18/pocket_rocket/,1664242977.0,xp2s18
536,Ticking/clicking/rattle sound coming from engine. Any ideas? Drives normal,Peter69696969,,18,9,0,9,,https://www.reddit.com/r/abarth/comments/xov8g4/tickingclickingrattle_sound_coming_from_engine/,1664225025.0,xov8g4
537,2014 Abarth for sale,finaldi,"77,800 miles. Multi air intake just replaced. SoCal. DM for details or questions.",6,14,0,14,,https://www.reddit.com/r/abarth/comments/xou82s/2014_abarth_for_sale/,1664222858.0,xou82s
538,Imagine with an Abarth engine?,ricktr0ll,,10,8,0,8,,https://www.reddit.com/r/abarth/comments/xos0d9/imagine_with_an_abarth_engine/,1664218081.0,xos0d9
539,Dumb LED headlight question,AWalt2580,"So i bought these… Fahren 9012/HIR2 LED Headlight Bulbs, 60W 14000 Lumens Super Bright LED Headlights Conversion Kit 6500K Cool White IP68 Waterproof, Pack of 2 https://a.co/d/gmFV54u

And frankly they are brighter and do look good (somewhat) but i feel they could fill out a lot more area.

Problem is this… The manufacturer recommends the headlights are vertical in the housing. So, I go to install the headlight and it is straightforward but when I am slotting them in to the headlight housing and then turn them to tighten up the fitting, one headlight is horizontal and one is diagonally slanted… 

I dont believe they can be turned or inserted any other way and i have reason to believe this is what is throwing the weird light pattern i am seeing. But i could just be dumb. 

Any advice?",4,2,0,2,,https://www.reddit.com/r/abarth/comments/xod2y5/dumb_led_headlight_question/,1664179924.0,xod2y5
540,NA 5-PIN to EU 4-PIN Taillight Conversion (NOT LED),4jellis,,0,11,0,11,,https://www.reddit.com/r/abarth/comments/xo8nfq/na_5pin_to_eu_4pin_taillight_conversion_not_led/,1664165265.0,xo8nfq
541,Looking to get a Spider but worried I won't fit. I'm 6'0. any issues?,HereForAdvice25,"So I'm 6'0 maybe just a little shy of 6'1 and I'm looking at getting a spider but have heard leg room is an issue? I can drive my friend's Fiat 500 no issue though.


UPDATE: I fit perfectly. I took one for a test drive today and am hoping to get one by next year!",10,6,0,6,,https://www.reddit.com/r/abarth/comments/xo68bu/looking_to_get_a_spider_but_worried_i_wont_fit_im/,1664158439.0,xo68bu
542,Track Sprint with CFR SCCA at Daytona International Speedway.,AVroman00,,9,15,0,15,,https://www.reddit.com/r/abarth/comments/xo330w/track_sprint_with_cfr_scca_at_daytona/,1664150069.0,xo330w
543,So fresh and so clean clean 🎵,Zadddyyyyyy,,10,44,0,44,,https://www.reddit.com/r/abarth/comments/xo07e1/so_fresh_and_so_clean_clean/,1664142696.0,xo07e1
544,Part number request,Intelligent-Mine9778,I pulled out my Beats subwoofer and I might keep it out. Does anyone have a part number for the non-Beats trunk lining panel? I want to swap them out and get my cargo room back.,1,1,0,1,,https://www.reddit.com/r/abarth/comments/xnv94u/part_number_request/,1664131027.0,xnv94u
545,wheel interchange-ability,seyahremmus,"Quick question.

I will soon be in possession of a Trofeo running on 17s.

Without delving into details I will be often finding myself driving through Europe and various areas where winter tyres are mandatory at the time I will be driving, so was looking at getting a spare set of wheels to stick winter tyres on.

Will 16s bolt on just fine or will there be issues with clearance? Doesn't seem to have the giant Brembo brakes on so I'm guessing it should be fine....larger sidewall of the 16s might help protect against some of the crappy roads I'll be driving on.

Help appreciated.",5,4,0,4,,https://www.reddit.com/r/abarth/comments/xnmyvt/wheel_interchangeability/,1664111382.0,xnmyvt
546,Fog lights on with no headlights?,bikewrench11,"I have seen pictures with cars that had fog lights on without the headlights.
Is that a ecm flash or user setting?",4,4,0,4,,https://www.reddit.com/r/abarth/comments/xmx02e/fog_lights_on_with_no_headlights/,1664036277.0,xmx02e
547,Squeaky brake problems!,up-the-glitter88,Just after a little advice. I had new disks and pads all round and since I got the car back the brakes are squeaking. I’ve tried ‘bedding’ them in and I’ve given it a few weeks. I took it back to the garage who took them all off and checked them all and re fitted them and they are doing it worse than ever! Any advice to stop it?,7,2,0,2,,https://www.reddit.com/r/abarth/comments/xmqq30/squeaky_brake_problems/,1664020047.0,xmqq30
548,Cool seats for your 500 Abarth…,ernestofreitas,,5,44,0,44,,https://www.reddit.com/r/abarth/comments/xmqoub/cool_seats_for_your_500_abarth/,1664019935.0,xmqoub
549,Blue and me Issue,bikewrench11,"My 2015 500 Abarth no longer connects to audio.  Phone calls are still fine.
Nothing has changed.  Same phone etc.
Any ideas?  I do not want to change the radio.  It is Beats Audio.",4,4,0,4,,https://www.reddit.com/r/abarth/comments/xmcrxs/blue_and_me_issue/,1663975957.0,xmcrxs
550,CD Player Repeat Song -2015 Abarth,OkYan4001,Anyone knows if there's a button/set up I can repeat 1 song for the CD player? I also searched on the 2015 Fiat user handbook and not able to find anything.,1,1,0,1,,https://www.reddit.com/r/abarth/comments/xmbp0k/cd_player_repeat_song_2015_abarth/,1663973139.0,xmbp0k
551,Abarth wanted,MessMurky9170,"Hi everyone,

I’m interested in purchasing a 500 Abarth. I live in NJ, but I’m also willing to buy from distance. Please let me know if you have anything available.

Thank you!",11,2,0,2,,https://www.reddit.com/r/abarth/comments/xm9mnh/abarth_wanted/,1663968065.0,xm9mnh
552,What to look for on higher mileage abarths,LCWrig922,"Found a screaming deal on a 2015 Abarth at a repo yard. It has 144k on the clock. Drove it and it drives better than mine with 80k on it. Anyone have high mileage ones here any tips to look out for?

Oh yeah. $6200 needs a headlight bulb and the switch for the mirrors. And to fix an exhaust rattle",13,7,0,7,,https://www.reddit.com/r/abarth/comments/xm6wtl/what_to_look_for_on_higher_mileage_abarths/,1663961548.0,xm6wtl
553,A Change From Stock 17's,4jellis,,29,92,0,92,,https://www.reddit.com/r/abarth/comments/xm5idm/a_change_from_stock_17s/,1663958187.0,xm5idm
554,Comfort mods,davixx500,Does anyone have any mods for the standard non sabbelt seats that make it more comfortable on long drives ? I love this little car but after 90 min my back just starts to hurt. Wondering if anyone has some mods or tips to make it more comfortable,12,1,0,1,,https://www.reddit.com/r/abarth/comments/xm4usx/comfort_mods/,1663956644.0,xm4usx
555,Anyone know the spark plug torque?,Moist_Cable_4247,"I'm about to change the spark plugs on my Abarth 595 2016 (145) bhp, but I can't find anything about spark plug torque in the owners manual.

Anyone have an idea what's the recommended torque.

I have 4 NKG IKR9J8 plugs",8,7,0,7,,https://www.reddit.com/r/abarth/comments/xl7i89/anyone_know_the_spark_plug_torque/,1663867383.0,xl7i89
556,Battery Draining issue here as well!!,Cold-Cat-7895,"Hey guys, it’s time that I write my question about our little cars.
I have an abarth 500 2013 pre facelift model, 135hp Automatic Transimission with buttons.
The problem is that if I let the car sit for 5-6 days the battery is dead, and when I say dead, I mean really dead.
Battery is new like a month ago and manufactured 05/2022, and everything was fine until I didnt drive it for 5-6 days now.
Extra tip, I have a dead Blue and Me Module and a weird sounding which I assume alternator.
Any tips ?",6,2,0,2,,https://www.reddit.com/r/abarth/comments/xku7qu/battery_draining_issue_here_as_well/,1663830116.0,xku7qu
557,Another track adventure!,jert1100,,2,37,0,37,,https://www.reddit.com/r/abarth/comments/xkpjpp/another_track_adventure/,1663815749.0,xkpjpp
558,This is a great ad!!,Viscovitz,,4,39,0,39,,https://www.reddit.com/r/abarth/comments/xkgyw3/this_is_a_great_ad/,1663794231.0,xkgyw3
559,Is it still worth it to get a open flash tablet?,Silentwolf10245,,16,5,0,5,,https://www.reddit.com/r/abarth/comments/xjkcxs/is_it_still_worth_it_to_get_a_open_flash_tablet/,1663707439.0,xjkcxs
560,I've got a couple questions;,Independent_Sky_517,"1. Has anyone used 4x100 wheels on 4x98 spacing, without using wobble bolts? 
2. I've just bought some ferodo ds2500 to replace the standard brembo pads on my 305mm disc 4 pots. The pads are the correct size but the holes for the pins don't line up, can I get away with filing the holes down?",4,3,0,3,,https://www.reddit.com/r/abarth/comments/xibc7g/ive_got_a_couple_questions/,1663592382.0,xibc7g
561,"Color code for touch up paint Abarth 2013 Rosso USA , PR4 or PR1?",wanabean,"Hello, Where I can find the correct color code of my Abarth? I looked under the hood but I do not see any code. The sale tag said: Rosso. Some websites says is PR1, but for my eyes PR1 is darker, more like red wine color. Thanks",3,7,0,7,,https://www.reddit.com/r/abarth/comments/xhunhv/color_code_for_touch_up_paint_abarth_2013_rosso/,1663541581.0,xhunhv
562,Looking for OEM 17” Abarth wheels,ddeeezzz,I live in SoCal and am looking to upgrade to 17” oem’s. Figured it doesn’t hurt to ask around before I go ahead and order from online. Thanks,2,6,0,6,,https://www.reddit.com/r/abarth/comments/xh9n8o/looking_for_oem_17_abarth_wheels/,1663484331.0,xh9n8o
